at,reviewId,content
2023-12-09 19:00:03,cd1bd259-0bcf-46dc-9a81-a800bf70e454,ここ数日、自販機とスマホの繋がりが悪くなりました
2023-12-09 19:00:03,cd1bd259-0bcf-46dc-9a81-a800bf70e454,アプリデザインの変更があってから繋がりが悪くなっています
2023-12-18 08:07:58,b77d3c36-58b8-4a4f-b896-b8a9fcaa908c,とにかくエラーが多すぎる
2023-12-18 08:07:58,b77d3c36-58b8-4a4f-b896-b8a9fcaa908c,キャンペーンはほとんど情報が取得できませんでした
2023-12-18 08:07:58,b77d3c36-58b8-4a4f-b896-b8a9fcaa908c,の表示が出て、ポイントだけが消費されていく
2023-12-18 08:07:58,b77d3c36-58b8-4a4f-b896-b8a9fcaa908c,24回やって、抽選がちゃんとできたのはたった一回
2023-12-18 08:07:58,b77d3c36-58b8-4a4f-b896-b8a9fcaa908c,もちろん外れだったけど
2023-12-18 08:07:58,b77d3c36-58b8-4a4f-b896-b8a9fcaa908c,手間ばかりとられて、楽しみがない
2023-12-18 08:07:58,b77d3c36-58b8-4a4f-b896-b8a9fcaa908c,エラー頻度が全く改善されない
2023-12-18 08:19:17,53bde183-a3fa-4f49-86a4-0bc29b869590,多くの自動販売機がほぼキャッシュレス決済できない中、コカコーラのみ利用できる安心感があります
2023-12-18 08:19:17,53bde183-a3fa-4f49-86a4-0bc29b869590,唯一不満な点としては挙動が全体的に遅いため、買いたいときに一旦立ち止まるような感覚になります
2023-12-18 08:19:17,53bde183-a3fa-4f49-86a4-0bc29b869590,特に商品情報の読み込みが遅いのは不満です
2023-12-18 08:19:17,53bde183-a3fa-4f49-86a4-0bc29b869590,キャッシュレスで利用できることには感謝しつつ、現金があったり複数本購入する際は利用をためらいます
2023-12-13 17:32:10,6e0a3948-dcde-4bc3-9fa6-8f2bad110fc9,更新したら、使いづらい
2023-12-13 17:32:10,6e0a3948-dcde-4bc3-9fa6-8f2bad110fc9,1本購入したらスタンプ貰えるけど、2本目続けて買う時また接続スイッチ入れると知らず、2本目のスタンプ貰えなかった
2023-12-13 17:32:10,6e0a3948-dcde-4bc3-9fa6-8f2bad110fc9,そのまま接続状態の方が使いやすい
2023-12-13 17:32:10,6e0a3948-dcde-4bc3-9fa6-8f2bad110fc9,あとエラーも多すぎ
2023-12-13 17:32:10,6e0a3948-dcde-4bc3-9fa6-8f2bad110fc9,コカ・コーラ自販機なのに、使える自販機なのにアプリ使えないのがイライラする
2023-12-20 17:14:38,e7e9b758-e736-4d36-bef4-299ff29bd839,連続して購入する際に一度bluetoothが切れてしまったり、再度繋がったと思ったら勝手に切れたりする
2023-12-20 17:14:38,e7e9b758-e736-4d36-bef4-299ff29bd839,自販機の電波状態が悪いのか、それともスマホが勝手に切ってしまうのか分からないがかなり不便に感じる
2023-12-20 17:14:38,e7e9b758-e736-4d36-bef4-299ff29bd839,ロスしたスタンプが目に余り多いので改善して欲しい
2023-12-19 01:41:40,f0512e0b-cab2-4c0c-a464-93157b8935ab,よくpaypayを使って飲み物を買っているのですが、自販機の接続を切るを選択しても全然反応が無い
2023-12-19 01:41:40,f0512e0b-cab2-4c0c-a464-93157b8935ab,仕方が無いのでそのままbluetoothを切ると自販機に勝手に接続しようとしておかしくなるバグが出てまともに動かない
2023-12-19 01:41:40,f0512e0b-cab2-4c0c-a464-93157b8935ab,移動してもアプリを立ち上げ直してもこの状態
2023-12-19 01:41:40,f0512e0b-cab2-4c0c-a464-93157b8935ab,抽選も歩数計も見られないのですが何とかならないてすかね
2023-12-19 01:41:40,f0512e0b-cab2-4c0c-a464-93157b8935ab,アプリをインストールし直したらデータ消えそうで怖いし
2023-12-19 01:41:40,f0512e0b-cab2-4c0c-a464-93157b8935ab,追記設定をいじって何回か起動し直したらいつの間にか直ってました
2023-12-19 01:41:40,f0512e0b-cab2-4c0c-a464-93157b8935ab,何だったんだろう
2023-12-19 01:41:40,f0512e0b-cab2-4c0c-a464-93157b8935ab,このアプリは便利だけど不安定過ぎて嫌になります
2023-12-07 08:05:29,03736065-7e28-4310-856e-319277c55dc7,愛用していますスタート当時に比べ繋がりやすくなったことと、対応機器が増えたことでより使うようになりました
2023-12-07 08:05:29,03736065-7e28-4310-856e-319277c55dc7,いつも沢山のキャンペーンをやっていて楽しめます
2023-12-07 08:05:29,03736065-7e28-4310-856e-319277c55dc7,贔屓にしてるからこそ、ドリンクの種類にも少しバリエーションが広まると嬉しいです
2023-12-07 08:05:29,03736065-7e28-4310-856e-319277c55dc7,小さな子供が飲めるものが少なく、いつでもいろはすかqooになってしまうのが少し悩みどころです
2023-12-07 08:05:29,03736065-7e28-4310-856e-319277c55dc7,ペコペコのペットボトルは小さな子供には少し飲みにくいのです
2023-12-17 12:13:08,3cf03331-8cf8-475b-8c45-3e5c00e4ca0d,googlepixel7aでは使えないよ
2023-12-17 12:13:08,3cf03331-8cf8-475b-8c45-3e5c00e4ca0d,アプリが何回も再起動を繰り返して、結局止まる
2023-12-17 12:13:08,3cf03331-8cf8-475b-8c45-3e5c00e4ca0d,使えね〜追記一時は回復して使えるようになったのだが、また勝手にアプリが再起動を繰り返してアプリが止まる
2023-12-17 12:13:08,3cf03331-8cf8-475b-8c45-3e5c00e4ca0d,pixel7aとの相性は最悪です
2023-12-17 12:13:08,3cf03331-8cf8-475b-8c45-3e5c00e4ca0d,使えないアプリ
2023-12-17 12:13:08,3cf03331-8cf8-475b-8c45-3e5c00e4ca0d,入金した分は返却してほしい
2023-12-17 12:13:08,3cf03331-8cf8-475b-8c45-3e5c00e4ca0d,販売機の前で時間を費やすの、ほんとに時間の無駄
2023-12-17 12:13:08,3cf03331-8cf8-475b-8c45-3e5c00e4ca0d,アプリ開発者は、ホントにヤル気があるのか疑ってしまう
2023-12-07 17:38:05,35a37909-aa8e-4fbf-9ab7-6da66f32c433,普段使いは特に不便は感じない
2023-12-07 17:38:05,35a37909-aa8e-4fbf-9ab7-6da66f32c433,idやパスワード以外に記録しなければならないアプリidとpinが必要で機種移行などで事前にしなければならない作業があるので不便を感じる
2023-12-07 17:38:05,35a37909-aa8e-4fbf-9ab7-6da66f32c433,これを間違えると今までのスタンプや無料チケットが引き継げないのが残念
2023-12-07 17:38:05,35a37909-aa8e-4fbf-9ab7-6da66f32c433,他の普段使いのアプリならgoogleアカウントやlineアカウントなどに紐づいていて面倒な事前作業がなく機種移行が出来るのにこのアプリだけはそういう補助がないのが際立つ
2023-12-07 17:38:05,35a37909-aa8e-4fbf-9ab7-6da66f32c433,それにアプリidとpinをメールで送るというのが出来ると謳っているが、送ってはこない
2023-12-07 17:38:05,35a37909-aa8e-4fbf-9ab7-6da66f32c433,認証コードは送られてきているので自分のメール設定のせいではない
2023-12-07 17:38:05,35a37909-aa8e-4fbf-9ab7-6da66f32c433,セキュリティは大事だが、使う側のことを考えてもらいたいものだ
2023-12-07 17:38:05,35a37909-aa8e-4fbf-9ab7-6da66f32c433,自分はある程度スマホを使えると思っているが、これでは不慣れな人や高齢者にはお勧めできない
2023-12-07 17:38:05,35a37909-aa8e-4fbf-9ab7-6da66f32c433,移行出来ずに損をしている人も、多数いるのではと思う
2023-12-07 17:38:05,35a37909-aa8e-4fbf-9ab7-6da66f32c433,それと生年月日などを入力するのに、それらはデータ復活にはなんのキーにもならない
2023-12-07 17:38:05,35a37909-aa8e-4fbf-9ab7-6da66f32c433,ただの購入者のデータを欲しいだけの登録だというのがわかる
2023-12-07 17:38:05,35a37909-aa8e-4fbf-9ab7-6da66f32c433,世界のコカ・コーラがこの程度のアプリを提供するととはね
2023-12-15 10:31:39,ec9bf107-6032-4b1c-a791-adef7f62305a,今現在稼働中のキャンペーンが、アプリ内で完結するものと外部接続になるものとある、網羅するのが大変なので改善してほしいです
2023-12-15 10:31:39,ec9bf107-6032-4b1c-a791-adef7f62305a,また、アプリで購入すると商品が出るまで時間がかかるため、後ろに人が並んでいるとハラハラします
2023-12-15 10:31:39,ec9bf107-6032-4b1c-a791-adef7f62305a,それ以外は概ね満足です
2023-12-17 02:52:14,69c14eb4-1b8f-4fc4-a1e3-b06a7ae91fb9,1スタンプが、歩いて貯まる
2023-12-17 02:52:14,69c14eb4-1b8f-4fc4-a1e3-b06a7ae91fb9,更に、企画やイベント時に1スタンプもらえる
2023-12-17 02:52:14,69c14eb4-1b8f-4fc4-a1e3-b06a7ae91fb9,更に1本買うだけでも、2スタンプもらえたりする時もあるので、15スタンプはすぐ集まりやすい
2023-12-17 02:52:14,69c14eb4-1b8f-4fc4-a1e3-b06a7ae91fb9,15スタンプでフリーのドリンクチケット貰えるのは嬉しいシステム
2023-12-17 02:52:14,69c14eb4-1b8f-4fc4-a1e3-b06a7ae91fb9,あと決済システム登録すれば、財布いらずで買えるのが非常に便利
2023-12-17 02:52:14,69c14eb4-1b8f-4fc4-a1e3-b06a7ae91fb9,ゲーム感覚で使える、お得で使い勝手のいいアプリ
2023-12-08 11:10:07,f1d5eaca-b433-4d71-a39d-59ff0343e8be,キャンペーンのときにエラーが多いです
2023-12-08 11:10:07,f1d5eaca-b433-4d71-a39d-59ff0343e8be,改善を求めます
2023-12-08 11:10:07,f1d5eaca-b433-4d71-a39d-59ff0343e8be,当たったか外れたかもわからないなんて、消費者としては悲しいです
2023-12-08 11:10:07,f1d5eaca-b433-4d71-a39d-59ff0343e8be,過去にはオリンピックと連動したキャンペーンの処理がパンクしてたときはキャンペーンに当たっても読み込みできずに再抽選ではずれるというトラブルはありました
2023-12-11 16:27:14,b239482e-f096-49bb-9dbe-3aa46c8f86f3,時々、自販機のリーダーが、読み込まなくて、ポイントを2つもらえませんでした
2023-12-11 16:27:14,b239482e-f096-49bb-9dbe-3aa46c8f86f3,自販機とスマホを接続して、ジュースを購入して、ポイントをもらおうとしたら、読み込みが悪く、ポイントを2つもらいそこねました
2023-12-11 16:27:14,b239482e-f096-49bb-9dbe-3aa46c8f86f3,すごくいいなと思って、このアプリを入れたのに、もう使わない方がいいのかなと思ってしまいます
2023-12-15 11:46:33,15512f67-344d-4466-b2f0-dd56399b48d3,バーコードをスキャンした際に本日は獲得済みですという表示がたびたび出ます
2023-12-15 11:46:33,15512f67-344d-4466-b2f0-dd56399b48d3,その日に初めてスキャンしていますスタンプが貰えたかどうか分からない事が度々有ります
2023-12-15 11:46:33,15512f67-344d-4466-b2f0-dd56399b48d3,要望昔の自販機に有った様な購入してすぐのルーレット的なクジが有ったら楽しみが増えます
2023-12-14 17:30:34,2946b168-2ef5-4e9d-9a4d-dce645c1eaa0,・大々的なキャンペーンで釣っておいて、購入した途端表示された方限定のキャンペーンが出なくなった
2023-12-14 17:30:34,2946b168-2ef5-4e9d-9a4d-dce645c1eaa0,他の方々も同じようです
2023-12-14 17:30:34,2946b168-2ef5-4e9d-9a4d-dce645c1eaa0,しかもそのタイミングで表示~のキャンペーンの回数を増やす
2023-12-14 17:30:34,2946b168-2ef5-4e9d-9a4d-dce645c1eaa0,ユーザーをバカにし買えば買うほど損をするアプリです・自販機検索があてにならずなぜか内容に関わらず必須項目の都道府県を記入したにも関わらず、詳しい場所を教えてくれと自分たちで調べずさらなる個人情報を要求ドリチケを使いきり次第アンストします
2023-12-01 16:52:18,957c4251-6a49-4167-8c6d-90cfdbbee703,よくお散歩に行くのでその時自販機で飲み物を買うのが贅沢になっています
2023-12-01 16:52:18,957c4251-6a49-4167-8c6d-90cfdbbee703,自販機から物が出てくる時の音、感を開ける時の音が好きです
2023-12-01 16:52:18,957c4251-6a49-4167-8c6d-90cfdbbee703,しかもコークオンを入れていればスタンプを貯めて無料チケットが貰えて嬉しいです
2023-12-01 16:52:18,957c4251-6a49-4167-8c6d-90cfdbbee703,個人的な不満としてはココアをもっと美味しくして欲しいです
2023-12-01 16:52:18,957c4251-6a49-4167-8c6d-90cfdbbee703,あと、置いて欲しいです
2023-12-01 16:52:18,957c4251-6a49-4167-8c6d-90cfdbbee703,ここで言ってもしょうがないですが
2023-12-02 16:11:04,234a3c0a-1812-4074-8d46-2805d54c0079,自販機検索が全く当てにならない
2023-12-02 16:11:04,234a3c0a-1812-4074-8d46-2805d54c0079,表示されている場所に行っても、自販機自体が存在しなかったり、休業中の役所内だったり、自宅近くの自販機を探したところ、そんなことが3回連続で続いたため、心が折れました
2023-12-02 16:11:04,234a3c0a-1812-4074-8d46-2805d54c0079,歩いて無料クーポンがもらえるということで初めましたが、よく考えてみたら、たとえ無料だったとしてもコカ・コーラ社製品で飲みたいと思えるものはないという根本的なことに気づいたため、このままアンインストールします
2023-12-19 10:09:26,4e77b4fd-4b3d-4836-91d9-4b4490f52fe3,bluetoothをオンにしているのに、なかなか繋がらない
2023-12-19 10:09:26,4e77b4fd-4b3d-4836-91d9-4b4490f52fe3,すんなり繋がることの方がまれ
2023-12-19 10:09:26,4e77b4fd-4b3d-4836-91d9-4b4490f52fe3,繋がりの悪さはいっこうに改善されない
2023-12-19 10:09:26,4e77b4fd-4b3d-4836-91d9-4b4490f52fe3,どうにかならないのか
2023-12-19 10:09:26,4e77b4fd-4b3d-4836-91d9-4b4490f52fe3,あまり意味の無いアプリ
2023-12-19 10:09:26,4e77b4fd-4b3d-4836-91d9-4b4490f52fe3,同じコカ・コーラの自販機でもコークオンに非対応の自販機もあるし、同じコカ・コーラなら全てコークオン対応の自販機にしてほしい
2023-12-19 10:09:26,4e77b4fd-4b3d-4836-91d9-4b4490f52fe3,まあ自販機は高いのであまり買わないし、専らスーパーやコンビニで買う為あまり使うことはありません
2023-12-05 11:50:09,6440d565-17f7-4b28-acb5-38aa7bf2e315,嫌いじゃない
2023-12-05 11:50:09,6440d565-17f7-4b28-acb5-38aa7bf2e315,アプリ独自のイベントやスタンプもらえるゲームもあり、飽きさせないよう工夫されてる
2023-12-05 11:50:09,6440d565-17f7-4b28-acb5-38aa7bf2e315,自販機のジュース最近高くなった感あるからあまり飲まなくなったけど、それでもこのアプリがあるおかげでたまに飲んでる
2023-12-05 11:50:09,6440d565-17f7-4b28-acb5-38aa7bf2e315,今後としては、コーラ置いてるファミレスとか牛丼チェーン店とかとコラボしてくれると嬉しいかも*́꒳`*
2023-12-04 09:58:56,0f2bc9ed-2942-43a2-8c8e-77c890251599,自販機3台と繋がらず、試行錯誤の結果、再起動して繋がったが、途中、会員ログインと追加設定をしたためか、過去のスタンプが消えていた
2023-12-04 09:58:56,0f2bc9ed-2942-43a2-8c8e-77c890251599,無料券が2つ溜まってたのに
2023-12-04 09:58:56,0f2bc9ed-2942-43a2-8c8e-77c890251599,スタンプ統合くらいしてくださいよ
2023-12-19 10:20:34,2ac2d27e-ae35-488f-8d81-5e03cff35571,まぁ、普通だけど、たまに、ドリンクの抽選が、有って結構当たるのは嬉しいです
2023-12-19 10:20:34,2ac2d27e-ae35-488f-8d81-5e03cff35571,普段飲まないのや新製品も当たるので
2023-12-19 10:20:34,2ac2d27e-ae35-488f-8d81-5e03cff35571,各飲料のキャンペーンは、当たりません
2023-12-19 10:20:34,2ac2d27e-ae35-488f-8d81-5e03cff35571,精々、lineポイント、コークオンポイント位です
2023-12-19 10:20:34,2ac2d27e-ae35-488f-8d81-5e03cff35571,スタンプカード、初回に押してから、1年で無効になるのは、勿体ないです
2023-12-19 10:20:34,2ac2d27e-ae35-488f-8d81-5e03cff35571,貰ったばかりの誕生日スタンプが消えるのは残念です
2023-12-19 10:20:34,2ac2d27e-ae35-488f-8d81-5e03cff35571,此れは、貯まる迄、ずっと有っても良いのでは
2023-12-19 10:20:34,2ac2d27e-ae35-488f-8d81-5e03cff35571,チケットの期限は有っても良いので
2023-12-11 09:32:34,24bf36f7-5413-4a4c-9311-36c771eb865e,累計1000万歩を目指してみようを達成してから更新されない
2023-12-11 09:32:34,24bf36f7-5413-4a4c-9311-36c771eb865e,いつまでも次は1000万歩を目指してみようが表示されている
2023-12-11 09:32:34,24bf36f7-5413-4a4c-9311-36c771eb865e,2000万歩到達しても変化がない
2023-12-11 09:32:34,24bf36f7-5413-4a4c-9311-36c771eb865e,ポイントを貰えるのは良いけど細かいところがアプリの挙動として気になるので評価を修正
2023-12-09 22:20:58,c7fb2c9d-811f-4059-8acc-52ee7772d257,ただ買うだけじゃなく、その都度スタンプがたまりチケットがもらえるのが楽しみです
2023-12-09 22:20:58,c7fb2c9d-811f-4059-8acc-52ee7772d257,キャッシュレスで買えるのがうれしいです
2023-12-09 22:20:58,c7fb2c9d-811f-4059-8acc-52ee7772d257,ゲームはタッチするタイプのは指が反応しないのでなかなかできなくて大変だから嫌だなー
2023-12-15 22:31:29,e458f795-ef1e-4b00-9063-66001eb1242f,5年ほど利用しています
2023-12-15 22:31:29,e458f795-ef1e-4b00-9063-66001eb1242f,昨年くらいから異様にキャンペーン関連の無料チケットが全く当たらなくなりました
2023-12-15 22:31:29,e458f795-ef1e-4b00-9063-66001eb1242f,キャンペーン期間中毎日ドリンクを購入しても当たらない
2023-12-15 22:31:29,e458f795-ef1e-4b00-9063-66001eb1242f,本当に何十万人に当たるのか
2023-12-15 22:31:29,e458f795-ef1e-4b00-9063-66001eb1242f,と思うほど約2年間当たっていないです
2023-12-15 22:31:29,e458f795-ef1e-4b00-9063-66001eb1242f,また、自販機の検索も近くにないなーと思いきや、検索に表示されないcokeon対応自販機が結構あります
2023-12-15 22:31:29,e458f795-ef1e-4b00-9063-66001eb1242f,スタンプを貯めてもらえる無料チケットでの利便性しかあまり感じません
2023-12-11 21:43:43,f9b2e369-25f1-4760-9659-7f3aec0a5fc1,11月30日辺りのアプリのリニューアル後より、自販機と劇的に繋がりにくくなった
2023-12-11 21:43:43,f9b2e369-25f1-4760-9659-7f3aec0a5fc1,以前はもっと繋がりやすかったので、繋がる繋がらないの閾値的なものを下げたほうが良いのではないでしょうか
2023-12-18 08:49:12,1d151922-5a9c-448a-9332-1754cfbb778d,とにかく良く切断されます
2023-12-18 08:49:12,1d151922-5a9c-448a-9332-1754cfbb778d,特に月曜の朝は何度もエラーが出て使えないことが多い
2023-12-18 08:49:12,1d151922-5a9c-448a-9332-1754cfbb778d,特典的には満足ですが
2023-12-18 08:49:12,1d151922-5a9c-448a-9332-1754cfbb778d,すごく残念
2023-12-08 10:07:48,78ec59b9-0b13-4b88-94ec-ce56dff61716,購入後に自販機との接続を切れない
2023-12-08 10:07:48,78ec59b9-0b13-4b88-94ec-ce56dff61716,画面が戻らない
2023-12-08 10:07:48,78ec59b9-0b13-4b88-94ec-ce56dff61716,接続を切りますか
2023-12-08 10:07:48,78ec59b9-0b13-4b88-94ec-ce56dff61716,にはいと答えているのに接続画面のままです
2023-12-08 10:07:48,78ec59b9-0b13-4b88-94ec-ce56dff61716,不便
2023-12-19 12:11:47,61c018df-89d9-41d7-97f2-f82a586dccbf,bluetoothが切れるようになった
2023-12-19 12:11:47,61c018df-89d9-41d7-97f2-f82a586dccbf,センサー前に当てていて、商品購入時に若干ずれただけで繋げていますの画面になってしまう
2023-12-01 20:59:55,eba2faaa-c31a-46d5-98fb-19d22e6f19d5,急いでいるときには絶対に使えない
2023-12-01 20:59:55,eba2faaa-c31a-46d5-98fb-19d22e6f19d5,通信状態関係なく接続出来ないことが多く、端末再起動すれば改善されるけど時間ないときにやりたくない
2023-12-01 20:59:55,eba2faaa-c31a-46d5-98fb-19d22e6f19d5,キャンペーン等でドリンクチケット貰えたりするのは嬉しいけど通信状態悪くてチケット呑まれた場合はお問い合わせで日時や選んだ商品やら細かく報告してチケット返却してもらう必要あるので時間ないとダメですね
2023-12-14 12:31:12,99eaa5a4-2fa8-404d-879c-b21adad08d8d,アプリの機能としては申し分ない内容だと思う
2023-12-14 12:31:12,99eaa5a4-2fa8-404d-879c-b21adad08d8d,動作にも不満もなく、自分としては良いアプリだ
2023-12-14 12:31:12,99eaa5a4-2fa8-404d-879c-b21adad08d8d,文字読み取りスキャンは面白い機能で、精度も良好で、今後をこれを活用したキャンペーンを色々と展開すると面白いのでは
2023-12-06 22:53:25,b5aa62ba-f45b-43e4-8450-dcf1e9c22397,ダメなアプリでした
2023-12-06 22:53:25,b5aa62ba-f45b-43e4-8450-dcf1e9c22397,週替りクリスマスギフトのアイコン作れるということになってるけど、画像を長押しして保存と書いてある通りにすると必ず固まる
2023-12-06 22:53:25,b5aa62ba-f45b-43e4-8450-dcf1e9c22397,保存出来ない
2023-12-06 22:53:25,b5aa62ba-f45b-43e4-8450-dcf1e9c22397,自販機で購入するときも通信時間が長くて後ろに並んでる人に気を使う
2023-12-06 22:53:25,b5aa62ba-f45b-43e4-8450-dcf1e9c22397,サントリーの自販機でsuicaで買うほうが早くて便利
2023-12-08 08:15:00,972447f7-9372-4c89-9074-46a5e6b8ee0b,歩くたびに毎週スタンプがもらえて、15個貯めるとチケット
2023-12-08 08:15:00,972447f7-9372-4c89-9074-46a5e6b8ee0b,お得感いっぱい
2023-12-08 08:15:00,972447f7-9372-4c89-9074-46a5e6b8ee0b,たまにある無料プレゼントも結構な確率で当たるので毎日チェック
2023-12-08 08:15:00,972447f7-9372-4c89-9074-46a5e6b8ee0b,自販機の商品は少しお高いかなと思いますが、毎週月曜はスタンプ2倍なので必ず買っています
2023-12-08 10:48:06,d4609c84-4db9-497a-a958-ce3fc0c8bea2,社内の自販機で使っているが、最近はかなりの確率で接続が出来ず、非常にイライラさせられます
2023-12-08 10:48:06,d4609c84-4db9-497a-a958-ce3fc0c8bea2,アプリを使わずそのまま買うのは損をした気分になるので、アンインストールしてコカ・コーラの製品は買わない事にします
2023-12-15 17:56:18,2ecb0e43-462b-47f3-b6c5-436a8edcfb05,楽しいアプリですが、自販機との接続が時間かかり過ぎる事があり、そういう時はもう止めようかと思う
2023-12-15 17:56:18,2ecb0e43-462b-47f3-b6c5-436a8edcfb05,2023/12接続エラーや、購入通信中のエラーが少なくなってストレスが緩和しました
2023-12-15 17:56:18,2ecb0e43-462b-47f3-b6c5-436a8edcfb05,あとは、いつも買っている自販機で商品読み込み中が長いのでなんとかなりませんか
2023-12-10 21:57:14,a687a621-1dd3-4d9e-b0bd-4d535a1a544e,まだ使い始めて2ヶ月目でヘビーには使っていませんがウォーキングをしてる者としては励みになるシステムだと感じてます♪日常のウォーキングでスタンプを貰えて一定数貯めると一本ドリンクが貰えるのは当たり付きの自販機よりもお得感は高いですょ♪
2023-12-14 02:31:47,32e285d0-8e38-407c-86d3-5d4bbf7bf501,ちいかわのキャンペーンに応募できない
2023-12-14 02:31:47,32e285d0-8e38-407c-86d3-5d4bbf7bf501,エラーが出て、ポイントだけが消費されて0ゼロになる
2023-12-14 02:31:47,32e285d0-8e38-407c-86d3-5d4bbf7bf501,janコード読み取りを、その日初めてやったにもかかわらず〈本日は獲得済みです〉と表示される
2023-12-14 02:31:47,32e285d0-8e38-407c-86d3-5d4bbf7bf501,他のイベントでも、まだ抽選してないのに〈本日は抽選済みです〉と表示される
2023-12-14 02:31:47,32e285d0-8e38-407c-86d3-5d4bbf7bf501,なんで
2023-12-20 12:12:26,97243bd2-8c9f-49de-9d0c-9417fa0b2970,この前のアプデ以降5、6回購入するも一度もスタンプが貰えておらずストレスです
2023-12-20 12:12:26,97243bd2-8c9f-49de-9d0c-9417fa0b2970,接続中に購入してもスタンプ押さずに再接続となる
2023-12-20 12:12:26,97243bd2-8c9f-49de-9d0c-9417fa0b2970,今までお得に使えてよかっただけに残念
2023-12-20 12:12:26,97243bd2-8c9f-49de-9d0c-9417fa0b2970,チケット使用後にいったんアンインストールします
2023-12-15 14:09:36,4a139551-9c07-4583-98d5-39c2140f0196,便利ではない
2023-12-15 14:09:36,4a139551-9c07-4583-98d5-39c2140f0196,コンビニ比べると高い
2023-12-15 14:09:36,4a139551-9c07-4583-98d5-39c2140f0196,でも、スタンプを集めたくなる
2023-12-15 14:09:36,4a139551-9c07-4583-98d5-39c2140f0196,腹立つけどやってしまう
2023-12-15 14:09:36,4a139551-9c07-4583-98d5-39c2140f0196,もう少しお得感があるとうれしい
2023-12-15 14:09:36,4a139551-9c07-4583-98d5-39c2140f0196,今の時代、自動販売機で定価買う人います〜
2023-12-03 03:53:22,b5c49464-9d2f-4baa-b182-ee05bd0b10b9,何日も何度やっても自販機に繋がらない
2023-12-03 03:53:22,b5c49464-9d2f-4baa-b182-ee05bd0b10b9,スマホはココへ
