at,reviewId,content
2023-11-08 16:05:40,70690233-47cf-47fa-a6d1-b2c2b4d33a77,自販機との向き合い方も変わったので今後も期待ですね
2023-11-06 23:53:44,639a4682-c3bf-4347-abc9-1f41674de591,数年前、アプリを使ったが余りに使いにくく使用をやめていた
2023-11-06 23:53:44,639a4682-c3bf-4347-abc9-1f41674de591,今日改善を期待し数年ぶりにアプリをインストールしたがログインさえ出来ない
2023-11-06 23:53:44,639a4682-c3bf-4347-abc9-1f41674de591,アプリでログインしようと、ステップ1で生年月日を設定、コカ・コーラアカウントでログインを押すとブラウザに勝手に移行
2023-11-06 23:53:44,639a4682-c3bf-4347-abc9-1f41674de591,そこでパスワードを忘れたを押し、メアド入力し、認証コードを入れると認証は出来る
2023-11-06 23:53:44,639a4682-c3bf-4347-abc9-1f41674de591,しかし設定するを押すと2022年
2023-11-06 23:53:44,639a4682-c3bf-4347-abc9-1f41674de591,ログインページからログインをお試し下さいと赤く表示される
2023-11-06 23:53:44,639a4682-c3bf-4347-abc9-1f41674de591,アプリに戻ってログインしようとすると同じことの繰り返しになる
2023-11-06 23:53:44,639a4682-c3bf-4347-abc9-1f41674de591,どうなっているのだ
2023-11-01 18:34:14,5292e6ce-6db8-4cb1-b53a-d482de83f5e9,個人的には、使い勝手が良いと感じる
2023-11-01 18:34:14,5292e6ce-6db8-4cb1-b53a-d482de83f5e9,だが、販売機と接続するのに多少時間がかかるのが難点
2023-11-01 18:34:14,5292e6ce-6db8-4cb1-b53a-d482de83f5e9,アプリを立ち上げてすぐ接続できるようになるor対象販売機の前に立ったら、自動で接続されるようになると更に良い
2023-11-01 18:34:14,5292e6ce-6db8-4cb1-b53a-d482de83f5e9,またスマホ自体の歩数とマッチしていないので、スマホと歩数を連動させるか自分で反映できるようにして欲しい
2023-11-05 12:31:04,7bfa5a7a-e200-41a2-88fc-2d645ac2882c,歩くだけで、スタンプ貰えて
2023-11-05 12:31:04,7bfa5a7a-e200-41a2-88fc-2d645ac2882c,さらにお得にドリンクがゲット出来るから最高
2023-11-05 12:31:04,7bfa5a7a-e200-41a2-88fc-2d645ac2882c,今まで、歩くのもしんどいなと思っていた自分がスタンプ欲しさに歩いて達成した満足感があって楽しい♪健康の為にも歩く事は大事だし、楽しくスタンプを貯められるのもまた魅力のアプリだと思います
2023-11-05 12:31:04,7bfa5a7a-e200-41a2-88fc-2d645ac2882c,またお得にスタンプがゲット出来るイベントをどんどん実施して欲しい
2023-11-19 20:34:14,adeb342e-8aca-4ebe-bfc6-537ef3bc9361,結構使ってましたが、引き継ぎできない上に問い合わせメールが届かないというスバラシイアプリですwログイン→メアド入力→パスワード変更してください→メアド再入力→承認→電話番号→承認
2023-11-19 20:34:14,adeb342e-8aca-4ebe-bfc6-537ef3bc9361,できずに登録済みなので別のをお使いください
2023-11-19 20:34:14,adeb342e-8aca-4ebe-bfc6-537ef3bc9361,いやいやw自分の番号だから登録済みに決まっとるがな
2023-11-19 20:34:14,adeb342e-8aca-4ebe-bfc6-537ef3bc9361,問い合わせしようとしても連絡不可でメール返ってくる
2023-11-19 20:34:14,adeb342e-8aca-4ebe-bfc6-537ef3bc9361,マジで公式アプリなんかな
2023-11-19 20:34:14,adeb342e-8aca-4ebe-bfc6-537ef3bc9361,アプリ自体は広告出まくりで徐々に重くなる仕様
2023-11-19 20:34:14,adeb342e-8aca-4ebe-bfc6-537ef3bc9361,ポイントは貯まるけどいうほどお得でもないわな
2023-11-19 20:34:14,adeb342e-8aca-4ebe-bfc6-537ef3bc9361,15ポイント貯めるよりもスーパーで買ったほうが断然安いしな
2023-11-05 07:17:02,aeaee351-3cc2-47be-809c-4a98e11aac10,いつもウォーキングしていて、ただするより何かに還元出来たらと思って使ってみたら、ドリンクがもらえる現実感が通常のポイントアプリより還元される感覚が強く感じました
2023-11-05 07:17:02,aeaee351-3cc2-47be-809c-4a98e11aac10,また、商品購入でもポイントが貯まるのでお得な気がします
2023-11-01 15:12:05,be70ada4-75c6-4df7-8de4-dd5e079e68f1,携帯の機種によってはほぼ繋がらず、使っていて得をしたという実感はあまりありません
2023-11-01 15:12:05,be70ada4-75c6-4df7-8de4-dd5e079e68f1,sharpのものは問題なく、googleのものはほぼ死亡、差がありすぎますねコカ・コーラ社の飲料は美味しいですから、自販機で買うのはもうやめた方が良いのではないか、と感じました
2023-11-01 15:12:05,be70ada4-75c6-4df7-8de4-dd5e079e68f1,このアプリのせいで他社の飲料を買うほうがいいや、ってなった人は多数います
2023-11-29 13:31:04,c9c88d94-d0e9-46c6-94c9-bef6933b20a1,バーコードの読み取りやキャンペーンの応募ボタンを押しても何度も元のページに戻る
2023-11-29 13:31:04,c9c88d94-d0e9-46c6-94c9-bef6933b20a1,問い合わせをしてもキャッシュを消す、1度アンインストールする、と案内されますが改善しません
2023-11-29 13:31:04,c9c88d94-d0e9-46c6-94c9-bef6933b20a1,自販機にかざしても反応しないことも多く困ってます
2023-11-27 16:53:14,abed9d89-891e-472e-bbd4-0a0bd7991912,自販機と接続するのに時間がかかることが良くある
2023-11-27 16:53:14,abed9d89-891e-472e-bbd4-0a0bd7991912,購入の際にとにかく時間がかかるので、後ろに人が待っていると使用を躊躇ってしまう
2023-11-27 16:53:14,abed9d89-891e-472e-bbd4-0a0bd7991912,キャップのスキャンやqrコードに対応した商品をもっと増やして欲しい
2023-11-15 18:41:01,7ba1a0ed-7fb4-450a-b985-3b0478b3b5d0,15本の購入で1本のサービスをもらえるので、良いと思います
2023-11-15 18:41:01,7ba1a0ed-7fb4-450a-b985-3b0478b3b5d0,時間帯や種類で2ポイント獲得出来る時も有り、お得感も味わっています
2023-11-15 18:41:01,7ba1a0ed-7fb4-450a-b985-3b0478b3b5d0,たまに購入中に接続が切れてしまい残念な時もありますが、楽しんで利用しています
2023-11-19 12:20:09,05da428e-51d0-4b2b-ab99-121db0573ae5,接続に時間がかかりすぎるので周りに人がいるときは使いづらい
2023-11-19 12:20:09,05da428e-51d0-4b2b-ab99-121db0573ae5,接続できないときは1分あがいて結局だめだったことも
2023-11-19 12:20:09,05da428e-51d0-4b2b-ab99-121db0573ae5,ストレス解消に買う缶コーヒーでストレスがたまることも
2023-11-19 12:20:09,05da428e-51d0-4b2b-ab99-121db0573ae5,ポイントが貯まる点は評価するが接続の課題の方が大きい
2023-11-19 12:20:09,05da428e-51d0-4b2b-ab99-121db0573ae5,paypayくらいの手軽さにはならないのか
2023-11-10 17:34:55,b19f38e9-2cc8-4aa7-8e82-d3232d34b4a4,仕事が変わって、館内の自販機でドリンクを買うことが多くなったので、スタンプが貯まってお得な気持ちになる
2023-11-10 17:34:55,b19f38e9-2cc8-4aa7-8e82-d3232d34b4a4,あとは、歩いた歩数でスタンプが貰えたりして
2023-11-10 17:34:55,b19f38e9-2cc8-4aa7-8e82-d3232d34b4a4,楽しみが増えた
2023-11-10 17:34:55,b19f38e9-2cc8-4aa7-8e82-d3232d34b4a4,先輩方もアプリを入れ、ゲームやスタンプ、チケットを貰うのを楽しんでいる
2023-11-21 06:51:21,dad648a5-43a6-465e-b71e-8528b6edd85c,スタンプを集める方法が色々あるので楽しいし、確実に貯まるので嬉しいです
2023-11-21 06:51:21,dad648a5-43a6-465e-b71e-8528b6edd85c,また、スタンプラリー以外にもキャンペーンでかなり色々当たります
2023-11-21 06:51:21,dad648a5-43a6-465e-b71e-8528b6edd85c,ジョージアは何本当たった分からないほど
2023-11-21 06:51:21,dad648a5-43a6-465e-b71e-8528b6edd85c,あとはブランケットが当たった時は本当に驚きました
2023-11-21 06:51:21,dad648a5-43a6-465e-b71e-8528b6edd85c,オススメです
2023-11-02 22:11:30,f61c6848-3ce5-4d5d-9b91-28e4d11e5264,無料で一本もらうのに、15本も買わなくていいって分かったら、率先して使うようになった
2023-11-02 22:11:30,f61c6848-3ce5-4d5d-9b91-28e4d11e5264,決済方法も買い方も多彩で、どの方法で払うかは、その時のキャンペーンしだい
2023-11-02 22:11:30,f61c6848-3ce5-4d5d-9b91-28e4d11e5264,でも、色々応募してるけど、なかなか当たらない
2023-11-02 22:11:30,f61c6848-3ce5-4d5d-9b91-28e4d11e5264,だから、星ひとつ減点っす
2023-11-04 23:01:59,f6abaae7-0e55-4664-8a45-f2e948175678,いつも自販機でドリンクを購入しています
2023-11-04 23:01:59,f6abaae7-0e55-4664-8a45-f2e948175678,便利ですね
2023-11-04 23:01:59,f6abaae7-0e55-4664-8a45-f2e948175678,いつの間にかチケットが貯まっています
2023-11-04 23:01:59,f6abaae7-0e55-4664-8a45-f2e948175678,もっと早くから利用すれば良かったと後悔しています
2023-11-04 23:01:59,f6abaae7-0e55-4664-8a45-f2e948175678,時々、アプリの反応が遅いときがあり、急いでいるとき困るときがあります
2023-11-04 23:01:59,f6abaae7-0e55-4664-8a45-f2e948175678,仕方ないのかな
2023-11-03 12:38:58,bccfe396-aa67-4503-80fd-af03319a9148,スタンプは結構溜まっていいのだが
2023-11-03 12:38:58,bccfe396-aa67-4503-80fd-af03319a9148,土日とか人が多く集まってる場所だと繋がりにくい事が多い
2023-11-03 12:38:58,bccfe396-aa67-4503-80fd-af03319a9148,ただでさえ小銭で買うよりも時間かかるのにより遅いw遅いだけならまだ良いが延々と繋がらない時もある
2023-11-03 12:38:58,bccfe396-aa67-4503-80fd-af03319a9148,スタンプあるから買ってるけど繋がらないなら別にcokeonの自販機で買う魅力的なもんもないし他のメーカーの自販機でいいやってなる
2023-11-10 23:03:23,d400242a-109a-46a7-8c4e-3f7713ff6283,aupayとの紐付けで使用しているがとても便利で使い安くて気に入ってます
2023-11-10 23:03:23,d400242a-109a-46a7-8c4e-3f7713ff6283,ただ今やっているキャンペーンのキャップを読み取るやつ全然読み取れないし、手入力も何が書いて有るか分かりづらい
2023-11-10 23:03:23,d400242a-109a-46a7-8c4e-3f7713ff6283,次やる時はもっと分かり安くしてください
2023-11-02 07:44:47,20a67d7c-bbeb-4fc6-9637-b4ded4280b51,接続されない1~2日空いただけでも接続不可になってしまう
2023-11-02 07:44:47,20a67d7c-bbeb-4fc6-9637-b4ded4280b51,iphoneは比較的繋がりやすいみたいですがandroidは繋がらない率高いみたいです
2023-11-02 07:44:47,20a67d7c-bbeb-4fc6-9637-b4ded4280b51,だから今日使おうと思う時は再起動されてこのアプリの為に使ってます
2023-11-24 15:07:07,2c0ea3b4-8601-4933-bc7a-5fe9d885f240,スタンプを貯めて1本無料になっていた所に、1本無料のクーポンが当たり、2本と引き換えたつもりが1本はpaypayで180円で購入となっていた
2023-11-24 15:07:07,2c0ea3b4-8601-4933-bc7a-5fe9d885f240,当日は1
2023-11-24 15:07:07,2c0ea3b4-8601-4933-bc7a-5fe9d885f240,5lのコーラを187円で買った後だったのだが、500mlを180円で買ってしまったことに暫し呆然としてしまった
2023-11-24 15:07:07,2c0ea3b4-8601-4933-bc7a-5fe9d885f240,決済時のスライドアクション時に大きな表示でクーポンで購入か支払いで購入と表示して頂きたい
2023-11-12 14:33:57,cb10a9d8-f6a5-42da-a0de-d421e699c33f,いろんなキャンペーンがあって面白さのあるアプリ
2023-11-12 14:33:57,cb10a9d8-f6a5-42da-a0de-d421e699c33f,自動販売機で買ってもスタンプ付かないときがたびたび
2023-11-12 14:33:57,cb10a9d8-f6a5-42da-a0de-d421e699c33f,起動や接続に時間が掛かるのが解消されると嬉しい
2023-11-18 14:55:39,336babf8-c814-4a8f-9289-3dd0a6427e0a,目標歩数歩いたり、商品を購入してすたんぷを集め、無料で商品と交換出来るようになるので、楽しく利用させて頂いてます
2023-11-18 14:55:39,336babf8-c814-4a8f-9289-3dd0a6427e0a,利用する側のわがままとして1点
2023-11-18 14:55:39,336babf8-c814-4a8f-9289-3dd0a6427e0a,自販機の値段が上がってしまったのですたんぷ15個交換から12個交換くらいに減らして欲しいです
2023-11-18 14:55:39,336babf8-c814-4a8f-9289-3dd0a6427e0a,そしたらもっと続け安い
2023-11-30 12:05:07,d4470ff6-3c7f-4a7f-85e8-d614ea768eba,新しいバージョンのアプリがありますと表示されてアップデートしようとしても、アップデートできず、元の画面に戻ると新しいバージョンのアプリがありますで無限ループ
2023-11-26 08:18:37,18f0127d-7ae9-473f-9d9b-3a9fb8a3c5cf,アプリで製品選択するのは判りにくいから、商品選ぶのは自販機側で、支払いだけタッチ決済みたいに出来ると良いんですけどね
2023-11-26 08:18:37,18f0127d-7ae9-473f-9d9b-3a9fb8a3c5cf,通信エラーも地味に多い感じがします
2023-11-26 08:18:37,18f0127d-7ae9-473f-9d9b-3a9fb8a3c5cf,小銭持ってなくて、飲みたいときに飲めないって最悪ですよね
2023-11-30 16:19:21,fb3fe845-eba7-4c27-8e7e-ae494ac5bc2b,何度かスタンプがつかないことがあり問い合わせを必要とすることが多い
2023-11-30 16:19:21,fb3fe845-eba7-4c27-8e7e-ae494ac5bc2b,改善ポイントと思う
2023-11-30 16:19:21,fb3fe845-eba7-4c27-8e7e-ae494ac5bc2b,またキャンペーン対象の自販機が分かりにくい
2023-11-30 16:19:21,fb3fe845-eba7-4c27-8e7e-ae494ac5bc2b,建物内にある自販機は重なってしまうためどれか分からない
2023-11-23 22:12:25,5232a794-db4a-4b80-aafe-5b8b358a23c9,以前はコークパスを利用してましたが、身近にあった自動販売機が撤去されたので、現在はコークパスは使っていません
2023-11-23 22:12:25,5232a794-db4a-4b80-aafe-5b8b358a23c9,でも、なんだかんだでスタンプが溜まるのでずっと使い続けたいです
2023-11-30 18:39:01,207b455d-da8f-4d14-8e25-ece7e9bbdda0,これリリースできるレベルのアプリじゃない
2023-11-30 18:39:01,207b455d-da8f-4d14-8e25-ece7e9bbdda0,検証せずに出してるっぽいバグだらけアプリ
2023-11-30 18:39:01,207b455d-da8f-4d14-8e25-ece7e9bbdda0,iphoneから移行したがfitと連携しても歩数のカウントちゃんとされない
2023-11-30 18:39:01,207b455d-da8f-4d14-8e25-ece7e9bbdda0,今日の歩数も出たかと思ったら次開いた時0になってたりしてマトモに動いてない
2023-11-30 18:39:01,207b455d-da8f-4d14-8e25-ece7e9bbdda0,iphoneに戻した方が良さそう
2023-11-12 13:31:56,4c430635-c0b4-4eef-8665-a465fe8d2eab,ペットボトルのキャップの文字読み取りの感度が悪すぎる
2023-11-12 13:31:56,4c430635-c0b4-4eef-8665-a465fe8d2eab,あまりに認識されないから手書きにしたら小文字入力できない
2023-11-12 13:31:56,4c430635-c0b4-4eef-8665-a465fe8d2eab,ゴミ
2023-11-12 13:31:56,4c430635-c0b4-4eef-8665-a465fe8d2eab,今すぐ直してください
2023-11-12 13:31:56,4c430635-c0b4-4eef-8665-a465fe8d2eab,そしてたたみかけるように入力がおわったらコード入力に間違いがあると
2023-11-12 13:31:56,4c430635-c0b4-4eef-8665-a465fe8d2eab,時間の無駄
2023-11-12 13:31:56,4c430635-c0b4-4eef-8665-a465fe8d2eab,改善してください
2023-11-30 12:46:20,c608a4c9-c9d5-4cd2-bcf8-9819587394b2,bluetooth設定、位置情報サービスをオンにしていても自販機に繋がらず、せっかくポイントをためて無料チケットをゲットしても使えません
2023-11-22 16:22:25,af691d89-e582-42c5-9759-fe7e26fd833d,スタンプは、月ごとに更新されたりしないので、貯めやすいです
2023-11-22 16:22:25,af691d89-e582-42c5-9759-fe7e26fd833d,チャレンジにも取り込むと、スタンプをくれるのでとてもいいと思います
2023-11-14 16:15:56,d9596c6d-37be-475e-9700-d07d2f32aee1,対応自販機が行動範囲にあれば、支払いに使うごとや規定量歩くごとににスタンプが貯まるため、思ったよりも交換チケットが貰えてありがたいです
2023-11-14 16:15:56,d9596c6d-37be-475e-9700-d07d2f32aee1,色々なキャンペーンも多く上手く使えば、とてもおトクだと思います
2023-11-18 21:11:49,22552e0b-98b3-4040-9a63-1d715604a38d,お得なサービスが多くて、まわりの人に勧めたら好評のアプリです
2023-11-18 21:11:49,22552e0b-98b3-4040-9a63-1d715604a38d,歩くだけで目標達成でスタンプが1週間に1個たまるのも素敵な特典です登録しなきゃ人生の3分の1は、損してしまうかもしれません笑
2023-11-21 12:27:48,e6e7aa5b-48eb-491a-b86d-a8cbb3c4d7d5,つい急いでるときに使った際、チケットを使いたかったのに通常の支払いになってしまいました
2023-11-21 12:27:48,e6e7aa5b-48eb-491a-b86d-a8cbb3c4d7d5,日中ですと画面が見づらく、あとからびっくりしましたできたらチケットがあるときはチケットを優先されるとありがたいです
2023-11-30 12:05:56,b653afe4-1dd7-4e2c-a8bb-e621c608a404,さっきアプリを開くとアップデートしてくださいと表示が出てgoogleplayに飛んで更新しようとするとアプリを開くのボタンしか出ません
2023-11-30 12:05:56,b653afe4-1dd7-4e2c-a8bb-e621c608a404,アレっと思ってアプリを開くとまたアップデートしてくださいの表示が出ます
2023-11-30 12:05:56,b653afe4-1dd7-4e2c-a8bb-e621c608a404,その繰り返しで、アプリが開けません
2023-11-30 12:05:56,b653afe4-1dd7-4e2c-a8bb-e621c608a404,直してください
2023-11-27 11:46:06,d0167a4a-1ef9-405e-8245-37ca93d32218,歩数計として使用中です
2023-11-27 11:46:06,d0167a4a-1ef9-405e-8245-37ca93d32218,アプリ連動してるのに、1日の歩数が0で表示されます
2023-11-27 11:46:06,d0167a4a-1ef9-405e-8245-37ca93d32218,ちゃんと表示されない場合の対策を試しましたが改善しません
2023-11-27 11:46:06,d0167a4a-1ef9-405e-8245-37ca93d32218,カウントはちゃんとしてるようですが、当日の歩数が分からないので星3です
2023-11-26 17:06:01,12d19ab9-eea5-4215-a04e-6757a1bdc445,ここ最近、自販機とは接続されてる黄色のランプから青のランプになってるのでのに商品一覧が出てこなく使えません
2023-11-26 17:06:01,12d19ab9-eea5-4215-a04e-6757a1bdc445,なぜ
2023-11-26 17:06:01,12d19ab9-eea5-4215-a04e-6757a1bdc445,商品も売切れではないです
2023-11-26 17:06:01,12d19ab9-eea5-4215-a04e-6757a1bdc445,今まで使えてたのに・・・
2023-11-26 17:06:01,12d19ab9-eea5-4215-a04e-6757a1bdc445,再起動しても変わりません
2023-11-14 12:33:59,bf690154-de24-4089-8721-ecff7a0f356c,どんなきつい言葉を使っても足りないくらいひどい
2023-11-14 12:33:59,bf690154-de24-4089-8721-ecff7a0f356c,11月半ばあたりから接続失敗するケースが多発して使い物にならなくなった
2023-11-14 12:33:59,bf690154-de24-4089-8721-ecff7a0f356c,なんでドリンクを買うだけで何分もかけなければならないのか
2023-11-10 23:56:35,41cda482-3f38-4b25-802b-9aad17dada4f,bluetoothや位置情報の許可通知が邪魔
2023-11-10 23:56:35,41cda482-3f38-4b25-802b-9aad17dada4f,許可したくないものもあるのだから、設定からオフにさせてほしい
2023-11-15 21:42:21,3200cddb-cdcd-4a58-8f36-9fda5c54c07a,もう数ヵ月、自販機には接続できるが、製品一覧が出てこないので、購入できないことが続いている
2023-11-15 21:42:21,3200cddb-cdcd-4a58-8f36-9fda5c54c07a,意味がないのでアンインストールを考え中
2023-11-15 21:42:21,3200cddb-cdcd-4a58-8f36-9fda5c54c07a,自販機数台で試して見たけどどれも、同じ結果になります
2023-11-01 13:00:29,057ca1fb-ceef-4c3b-bba9-e7d94edfe1c7,アプリは良いんですが、ここぞという所でcokeon未対応自販機ばかり
2023-11-01 13:00:29,057ca1fb-ceef-4c3b-bba9-e7d94edfe1c7,地方のボトラーズ会社だとダメなんですかね
2023-11-01 13:00:29,057ca1fb-ceef-4c3b-bba9-e7d94edfe1c7,殆ど対応していない
2023-11-01 13:00:29,057ca1fb-ceef-4c3b-bba9-e7d94edfe1c7,地図ではある程度出るけれども、コンビニと同程度の展開
2023-11-01 13:00:29,057ca1fb-ceef-4c3b-bba9-e7d94edfe1c7,自販機って、そこにあるから買うのであって、敢えてcokeonの為だけに遠くへ行く事は無い
2023-11-01 13:00:29,057ca1fb-ceef-4c3b-bba9-e7d94edfe1c7,コスト高いのかもしれませんが、もっと、というか全台の勢いで増やして欲しい
2023-11-14 16:58:08,b70f3523-500a-4627-ba89-dc25e77bc01d,自販機での買い物と、それ以外のイベントでもスタンプが貯まるので有り難いです
2023-11-14 16:58:08,b70f3523-500a-4627-ba89-dc25e77bc01d,便利に使ってます
2023-11-14 16:58:08,b70f3523-500a-4627-ba89-dc25e77bc01d,対応自販機がもっと増えるといいなと思います
2023-11-27 17:08:48,df5a1dd4-bf66-49fc-b82f-aea3b7e4ff06,ポイントチケットがサクサク貯まる画良いっがっ
2023-11-27 17:08:48,df5a1dd4-bf66-49fc-b82f-aea3b7e4ff06,しかし
2023-11-27 17:08:48,df5a1dd4-bf66-49fc-b82f-aea3b7e4ff06,、自動販売機との接続〜商品払出しまでが凄い時間が掛かる
2023-11-27 17:08:48,df5a1dd4-bf66-49fc-b82f-aea3b7e4ff06,稀に金額だけ引落され、商品が出て来ない時が有る
2023-11-02 08:20:24,2146d805-8e9d-4394-a909-542c8675829b,ウォーキングの歩数が反映されないことがしばしば
2023-11-02 08:20:24,2146d805-8e9d-4394-a909-542c8675829b,そのせいでスタンプがもらえず
2023-11-02 08:20:24,2146d805-8e9d-4394-a909-542c8675829b,明らかに歩数クリアしている時に限ってそうなる
2023-11-02 08:20:24,2146d805-8e9d-4394-a909-542c8675829b,無料で飲物を1本貰えたことはあるので、そこはありがたい
2023-11-08 15:20:30,f499f7ea-aa38-46ed-8dd6-c9a863e5092c,はじめの頃は、なかなか接続されず使えないアプリと思ってましたが、最近は改善されてサクサク使えます
2023-11-08 15:20:30,f499f7ea-aa38-46ed-8dd6-c9a863e5092c,結構、無料クーポンも発行されるので、いいアプリだと思います
2023-11-01 17:22:35,1605af91-f74c-4103-99fc-1df18e2c3ab9,ウォーキングや商品購入などで無料チケットがもらえるのでありがたいです
2023-11-01 17:22:35,1605af91-f74c-4103-99fc-1df18e2c3ab9,ときどきなぜか自販機に接続できないときもありますが便利なアプリです
2023-11-01 17:22:35,1605af91-f74c-4103-99fc-1df18e2c3ab9,キャンペーンでくじ引きなどもあるので楽しめます
2023-11-07 03:18:07,83416e03-e033-44a1-be6d-cd089dbe4ce8,コカ・コーラの自販機でよく買うなら絶対使ったほうがお得なアプリだと思います
2023-11-07 03:18:07,83416e03-e033-44a1-be6d-cd089dbe4ce8,個人的には一回で複数本買うこともあるので、購入画面で複数本買えるようにしてもらえると嬉しいです
2023-11-01 21:38:22,15c0698c-579f-42ec-9f1f-e28c13b8aba4,健康のためにウォーキングしています
2023-11-01 21:38:22,15c0698c-579f-42ec-9f1f-e28c13b8aba4,歩くだけでスタンプがたまるのが嬉しいです
2023-11-01 21:38:22,15c0698c-579f-42ec-9f1f-e28c13b8aba4,ただ、いざ買おうと立ち寄る自動販売機が対応でないものが多く、少し残念です
2023-11-07 08:46:26,a764fd51-4f6a-47ab-9887-b3715c58b115,なかなか便利なんですが、自動販売機毎に商品情報を取得するので買えるようになるまで微妙に時間がかかります
2023-11-07 08:46:26,a764fd51-4f6a-47ab-9887-b3715c58b115,後ろに並ばれると焦ります
2023-11-07 08:46:26,a764fd51-4f6a-47ab-9887-b3715c58b115,商品情報取得がもっと早くなれば満点
2023-11-07 12:30:10,2564ba6d-db31-4cb3-afea-ed3e863954de,数年前とは格段に変わり、商品を選びやすくなったし、ゲームも使いやすい
2023-11-07 12:30:10,2564ba6d-db31-4cb3-afea-ed3e863954de,スマートフォンの機種変更が面倒なので、対応願いたい
2023-11-06 10:52:30,4b92de2c-1eaa-4f13-a0ee-42bbf22879b8,使えないことが多くて逆に不便
2023-11-06 10:52:30,4b92de2c-1eaa-4f13-a0ee-42bbf22879b8,理由もわからず使えないことが多々あり、あてにならない
2023-11-06 10:52:30,4b92de2c-1eaa-4f13-a0ee-42bbf22879b8,bluetoothの不具合のように表示される
2023-11-08 23:43:19,842c8200-0c32-43c9-b662-9f2cd927fb9b,自販機の値段も上がったので、歩いて無料チケットもらえるのは助かる
2023-11-08 23:43:19,842c8200-0c32-43c9-b662-9f2cd927fb9b,キャンペーン中のドリンク購入だと、スタンプ2個とかもらえるので貯めやすい☆他のアプリみたいに動画視聴とかしなくて良いのでオススメ
2023-11-23 17:05:42,f3b7786d-83fa-438c-baed-b838be868a69,機種の問題なのか自販機の問題なのか分かりませんが、btの接続が安定しないのが本当にクソ今週に入ってから通信エラー出過ぎです
