at,reviewId,content
2023-10-05 07:21:36,e401a544-507f-400c-9a90-b99b69f058d9,買い物終わって、すぐ閉じられないのはちょっと不便です
2023-10-07 14:02:56,2cca0ee3-d8de-46b7-8925-28af0d435179,他のコンビニアプリと比べてクーポンの配布も多くてお得感があります
2023-10-02 12:40:59,7214d2a2-649e-4083-baef-d643c18c201c,戻るボタンでアプリが終了しなくなった
2023-10-02 12:40:59,7214d2a2-649e-4083-baef-d643c18c201c,終了するように改善してください
2023-10-20 04:17:46,71fd9ba6-52a1-4181-9383-6fd4a6f41aa3,最高で月25万円最近は月に1万円ぐらいで落ち着いてますありがとうございますいつも使わせて頂いて感謝しています過ごしくお菓子も美味しいし最近はおにぎりばっかり食べてますけどそのラップになってるやつも美味しいなと思うしパスタ屋お弁当が大好きです後サンドイッチをしょっちゅうたかっていますジュース思う本当に生活の基盤にしてしまってるので
2023-10-10 18:50:30,da627ecc-1369-42c5-8697-851d5ba5864f,jcbのクレジットカードしか登録できない使わせる気を感じさせないゴミアプリ
2023-10-10 18:50:30,da627ecc-1369-42c5-8697-851d5ba5864f,使い勝手が悪すぎる
2023-10-06 11:21:24,f35ee7f5-6cf0-46d2-9b30-d821a3e9aa79,カービィのコラボで登録しましたこども達、美味しいと喜んでます
2023-10-06 11:21:24,f35ee7f5-6cf0-46d2-9b30-d821a3e9aa79,これでカービィカフェ予約取れなかったけど、償いが出来た気になります〜
2023-10-03 00:08:06,156eb72c-1983-445e-af7a-4c96e858d489,スマホ操作が苦手な方ですが、見やすくて使いやすいアプリです
2023-10-14 10:28:16,36187cc3-911c-4447-8d4c-26a292b54dd2,クーポンやギフトがあり、良く行く所にファミマがあり、よくアプリを使う
2023-10-06 19:04:30,7152aeed-accd-4260-8080-cb98ab921e61,アップデート後、アプリが終了できなくなりました
2023-10-06 19:04:30,7152aeed-accd-4260-8080-cb98ab921e61,改悪です
2023-10-05 02:45:21,d27a8b43-241d-4256-9cc1-b425ccd3afa9,アプリを終了ができず毎回閉じるときは強制終了になるのどうにかしてほしい使いづらい
2023-10-06 09:56:49,a2d211b4-ec28-4a8f-a754-7722236e882a,毎日のチャレンジは某ーソンのアプリよりもポイントが貰えやすいので高評価です
2023-10-18 02:07:31,879607e1-e1da-4319-bbfb-8b9b28c0641d,多機能で良いです
2023-10-18 02:07:31,879607e1-e1da-4319-bbfb-8b9b28c0641d,使えるお店を更にもっと増やしてください
2023-10-10 11:55:27,8018a39b-efe4-440c-bfd7-489ae0a9631e,1点無料クーポンの通知があったのに、クーポン画面に出てこない
2023-10-04 19:19:44,128047ac-7f43-48c9-8f97-05910be1f57d,毎月当たるゲームがあって楽しみ
2023-10-04 19:19:44,128047ac-7f43-48c9-8f97-05910be1f57d,当たらないけど
2023-10-05 00:18:55,ee839995-03fe-4bff-a91d-26b799958327,ポイントが貯めづらい、200円以上ファミペイ利用しなければならないのですか
2023-10-05 00:18:55,ee839995-03fe-4bff-a91d-26b799958327,アプリの戻るボタンが反応せず、サポートセンターに質問すると回答が携帯キャリアに聞いてくれとのこと
2023-10-05 00:18:55,ee839995-03fe-4bff-a91d-26b799958327,アプリを見直す気無し
2023-10-07 10:08:00,3cc152a1-c9e5-4f4c-9b8a-2ecf251406fd,月2回のチャージの日もう、魅力がありません
2023-10-07 10:08:00,3cc152a1-c9e5-4f4c-9b8a-2ecf251406fd,弁当買わない人は100円引き全く意味がありせん
2023-10-09 19:59:50,e66d7d41-96a4-4093-88c7-2a53d0fd29bd,更新したら、アプリが終了できなくなった
2023-10-09 19:59:50,e66d7d41-96a4-4093-88c7-2a53d0fd29bd,最悪だ
2023-10-07 10:52:12,72f34788-0303-48f6-84a1-d87bf7d4784c,使いにくくなったね戻るをタップしてもアプリを解除出来ないし
2023-10-04 13:18:08,a56a2373-9ec1-462f-a3eb-b9e215cce5e3,レシートクーポンをその場でアプリに読み込んで合併出来るのは便利
2023-10-17 19:08:44,0b45891b-9eb7-44c1-9437-084f5a0fddf0,毎月クーポンキャンペーンがあって良いと思います
2023-10-16 11:20:47,3590091f-d56b-42ee-8129-d00fc4d25a6e,戻るボタンでアプリが終了出来ない
2023-10-01 20:44:10,12df2e75-e32a-4d4b-a3fb-ca12f6c90847,今回の更新でuiが洗練されてとても使いやすく、見やすくなりました
2023-10-02 07:07:05,909519e2-eb1f-462b-a8bf-afb707ab49bc,戻るボタンで閉じれなくなった
2023-10-02 07:07:05,909519e2-eb1f-462b-a8bf-afb707ab49bc,非常に不便
2023-10-12 16:30:06,16cc975d-62f2-43eb-8347-7b243cea9737,ゲームでファミマpayとdポイント、楽天ポイント、tポイントの1つを選べてポイントが貯まるのがめちゃいいですね
2023-10-02 08:29:06,ceeee738-eafd-4f6a-b5b7-9cc2f13646c9,クーポンを添付して一発で支払えるのでセブンイレブンに比べて格段に使いやすい
2023-10-02 08:29:06,ceeee738-eafd-4f6a-b5b7-9cc2f13646c9,レジでファミペイでって一言が少しメンドー笑
2023-10-05 10:25:21,7c953851-e4d1-4f63-881d-a2850c7f23dd,端末の戻る操作でアプリを終了できない
2023-10-04 06:53:49,ebe1586f-c027-4dab-8aba-5525c07b3550,デザイン改悪で使い難くなりました
2023-10-04 06:53:49,ebe1586f-c027-4dab-8aba-5525c07b3550,残念です
2023-10-17 10:37:42,68af6024-f172-4db6-967c-72ae3ce29f63,使いやすいしクーポンも分かりやすい
2023-10-10 10:43:34,b76c079c-dca3-492f-ad1a-869c8a5726d8,不定期なクーポンに大変満足です
2023-10-26 19:44:10,a0133429-bd68-4987-97d4-5d35bca33203,通勤途中でお世話になってます
2023-10-26 19:44:10,a0133429-bd68-4987-97d4-5d35bca33203,アメリカンドッグはここのが一番美味しい~
2023-10-10 15:33:25,3a74e503-04b8-4381-9822-bb26a772d291,無料実際は100円引きクーポンに満足したか
2023-10-10 15:33:25,3a74e503-04b8-4381-9822-bb26a772d291,と聞かれたらね
2023-10-10 15:49:02,5b8e6444-94fd-46be-95af-060b1a6cdd82,好きなビールを無料で頂けて、有難うございました
2023-10-10 15:49:02,5b8e6444-94fd-46be-95af-060b1a6cdd82,これからも宜しくお願いします
2023-10-20 01:34:27,ac0391b1-e1bf-4c87-b71f-7ddda3b549ea,とてもわかりやすく使いやすい
2023-10-01 23:00:29,63e170e3-9dc5-4881-a0bf-b7c1cefe9071,ファミペイアプリで、チャージしようとお店に行って、チャージをお願いしたら、このアプリだとチャージできないと言われました、とうしたらいいのか、教えてください
2023-10-19 22:47:03,5c971e3f-85d5-4b55-b15f-3943de82c8a3,そもそもいまどき050に電話要求するアプリってなんなん
2023-10-19 22:47:03,5c971e3f-85d5-4b55-b15f-3943de82c8a3,ページ開いても暗証番号のところは開かないし、ほんと1000円返せだよ他の決済アプリではこんなことないしね最悪の詐欺みたいなアプリ
2023-10-24 18:03:08,afff4cac-5f08-42e0-b347-6f3976252aa8,アルコール無料が時々届き、嬉しくてファミマに通ってしまいます
2023-10-24 18:03:08,afff4cac-5f08-42e0-b347-6f3976252aa8,友達にも勧めました
2023-10-24 18:39:11,46773c0d-5adb-4bf6-ace5-e114267c1039,チャージの日無くなるの
2023-10-24 18:39:11,46773c0d-5adb-4bf6-ace5-e114267c1039,チャージの日しかチャージしないのに
2023-10-31 12:48:28,56c036ae-483d-4012-b087-2134926b609b,クーポンもあり利便性はある
2023-10-21 22:17:02,80d64bd4-0cc5-4aa4-9e0b-caddc3781ccb,よくわからないまま入れてたのでアンインストール
2023-10-30 17:20:56,cce51e30-bda9-4494-abca-fc6f712cc64c,無料クーポンもよく当たるめっちゃいいです
2023-10-23 18:11:15,d2f78969-539a-406e-b822-52def259c166,ファミペイに登録できないクレジットカードが多すぎる
2023-10-31 20:17:50,bae792cb-58d9-4204-89cc-53ddb909ee77,インストールしたがずっと立ち上がらない
2023-10-14 18:29:05,d6c897b9-eb81-452f-a15f-565934982a50,ゲームでポイント貯まるし急にポイントが消えたりしない
2023-10-31 18:16:19,1b70a47f-55e8-45b1-891d-8c8d1cdcfc47,時々無料クーポンをもらえるのでとてもありがたいです
2023-10-31 18:16:19,1b70a47f-55e8-45b1-891d-8c8d1cdcfc47,ありがとうございますm__m
2023-10-08 09:13:59,f69890a0-a0bf-4688-a053-c29b9638bf22,戻るボタンでアプリが終了できなくなったような
2023-10-31 14:40:20,91759669-7f46-4b3b-89c1-3f610c61b385,お知らせでバイブを作動させるのやめてほしい
2023-10-10 10:06:55,5652b653-1197-4348-a398-cd7850a9f438,ドレッシング無料クーポンって通知きてクーポン見てみたら無料じゃなくて割引クーポンだったのですが、どういう事
2023-10-10 10:06:55,5652b653-1197-4348-a398-cd7850a9f438,何回見ても無料と書いてますが
2023-10-29 19:39:51,f9b97026-ea1b-4209-967e-f0169ec787ec,10万当った人居るんですか
2023-10-29 19:39:51,f9b97026-ea1b-4209-967e-f0169ec787ec,ファミペイボーナス有効期限短過ぎ使う暇無い
2023-10-29 19:39:51,f9b97026-ea1b-4209-967e-f0169ec787ec,もったいない
2023-10-10 10:01:55,c6a88de6-baa5-41ab-af21-41c62f135ffd,いまさっき、無料クーポンお届けってきたのに、無料じゃなくて100円引きクーポンなんだけどーどうなってんの
2023-10-10 12:51:54,b48b9d54-7255-435c-a735-264fe1e156a1,無料との通知ですが、クーポンは100円引きです
2023-10-10 12:51:54,b48b9d54-7255-435c-a735-264fe1e156a1,どちらが本当なの
2023-10-14 18:35:45,2e5929cb-5e90-44e3-a337-54f4ab7a858f,情報いっぱいにドリンクなど一本買って無理で一本もらえたりdポイントもたまるからラッキー
2023-10-06 16:05:52,aee438e0-2ce2-48c7-ab25-a7239a6395e2,とても使い辛く成りました
2023-10-06 16:05:52,aee438e0-2ce2-48c7-ab25-a7239a6395e2,改善して下さい
2023-10-04 19:56:48,e39c6e48-5ceb-4b74-ae36-a7d8326dd07e,アプリ更新して使いづらくなりました、以上
2023-10-14 19:43:34,1538e3e9-d9e7-49bb-8e9f-347393495312,アプリが見づらく&使いづらくなった
2023-10-14 19:43:34,1538e3e9-d9e7-49bb-8e9f-347393495312,このアプリに限らないが、なぜ無意味なレイアウト変更をしたがるのか
2023-10-08 07:00:19,9e44d660-bf24-41c1-bacc-3adf3e24a6f6,無料クーポン配信かなりあって助かります
2023-10-10 13:28:35,74a53c20-b922-4661-8298-413addb4803f,無料のファミマルドレッシングのクーポン配信のメッセージがきたのに実際きたのは100円引きクーポンでした
2023-10-10 13:28:35,74a53c20-b922-4661-8298-413addb4803f,残念です
2023-10-23 13:29:20,c6836d9d-d7df-472d-b466-830cbbd53776,注文が入っています
2023-10-23 13:29:20,c6836d9d-d7df-472d-b466-830cbbd53776,"作ります,1つは、買います"
2023-10-24 19:29:10,8436b8d2-25d5-4513-aed9-c09db309d5b1,イロイロ楽しんでます又色んなゲームお願い致します
2023-10-31 09:21:29,0aeff511-5fc8-413f-b4ac-a54b15a4eb19,ホーム画面のファミペイ翌月払いの表示を分かりやすくして欲しい
2023-10-10 13:41:04,72689850-6099-496d-9ec3-f1925c63c3a0,プレゼントをよくくれます❢❢ファミペイアプリ
2023-10-10 13:41:04,72689850-6099-496d-9ec3-f1925c63c3a0,最高
2023-10-25 18:42:44,e7e464d3-75a9-4723-a837-bdf73e26d610,寒くなって来たので、おでん意欲買います美味しいです
2023-10-27 14:14:25,b763b85d-e9de-4920-acf9-f55f14ad9f2c,アンケートに答えたらしつこくメールが来た
2023-10-11 14:06:30,587a7c97-0147-47ce-a526-f6121a8ed34a,使いづらいとの意見が大半
2023-10-11 14:06:30,587a7c97-0147-47ce-a526-f6121a8ed34a,元に戻せ
2023-10-11 14:06:30,587a7c97-0147-47ce-a526-f6121a8ed34a,セブンまねて、ファミリーマートwi-fiやめるなら、ファミマアプリ、ファミペイも辞めます
2023-10-11 14:06:30,587a7c97-0147-47ce-a526-f6121a8ed34a,繋がらなくなるから意味がない
2023-10-11 14:06:30,587a7c97-0147-47ce-a526-f6121a8ed34a,買い物も当然減る
2023-10-13 16:07:19,e97d3649-23af-4bd4-a114-493214354ec6,今朝も、目覚めの新製品旨いですね今夜もファミマで買い求めます◎の金曜日
2023-10-31 03:13:38,46554c62-1155-451e-b86e-d8a454164c10,複数の端末で使えない
2023-10-31 22:17:26,f77017b5-d748-48ad-806f-242e750de806,もう1本無料サービスラッキーでした
2023-10-22 10:38:39,ca5f897f-4187-4856-93d9-3c427354093a,毎朝使ってます
2023-10-31 07:32:14,3f2f468c-77ea-4cc3-b919-6216059e120b,dポイント貯めれるのにdカード使えない
2023-10-29 17:03:35,e0782545-036a-4d9f-8f4c-7b43df7722e0,毎回このアプリ使ってます
2023-10-29 04:39:28,b7809782-1067-4890-97f0-599816937d85,ほぼ、使ってません
2023-10-11 12:56:24,884f6327-e42c-4757-9591-1359f43f29d6,毎日楽しんでます
2023-10-13 11:25:16,71806020-7b8e-44a3-b493-fdb44d1f769d,ファミマのアプリは、いろんな特典がありますので、何時に行ってもお得感が味わえ
2023-10-29 10:22:32,4ab7fa28-69b7-4dfd-9744-80e0e45bbf6a,とてもお得ですねー
2023-10-07 06:06:28,2a144e77-c632-41e0-a066-43a29d462012,当たっても1円ばっかりですね
2023-10-07 17:36:13,03502d0e-0960-471d-8a45-dbd8c252488b,起動しませんどうしたらよいですか
2023-10-10 10:15:40,57c1c8c1-957b-4b47-b1a0-ec0df089d6c2,お得がたくさんあります
2023-10-10 10:56:26,fc699dbc-7f43-428c-8397-b9e1b29db536,ドレッシング無料と通知が来たのにクーポンは100円引きっておかしいですよね
2023-10-05 08:31:59,0b635fe5-19f3-43e8-a57e-63a61bf02595,あんただれのぶちやんがんばらなあかんなんばしよっと
2023-10-05 17:47:25,2e274b83-de4a-43b6-b9da-7a78f36ce02b,ポイントが期限切れやめてほしい
2023-10-04 17:23:06,be218222-de65-47a5-9d96-91e47f78fff4,便利に使ってます♪
2023-10-08 13:39:57,4487cdf3-a19d-4fd0-859c-8d93761bc1ff,入金自由度が低い
2023-10-12 16:20:22,e92bc33c-d8f5-42a2-ab36-36b5bcff5188,キャンペーン、クーポン利用でお得
2023-10-17 12:57:49,3b25c89f-bcc3-4fcc-87cd-177da03c4d0c,とってもよかったです
2023-10-26 12:25:19,3fcfcd5b-dc11-436a-bc4a-a6751edf54bd,とても良いです
2023-10-03 21:07:11,3bb0667c-5f34-4cef-8c17-b05f3fac4426,戻るジェスチャーをしても戻らないという致命傷
2023-10-12 04:54:43,34bf2c6d-8f1f-4e45-b2ff-7a463d5a8ec4,なんとかpayが多すぎて何が便利なのか分からない
2023-10-12 04:54:43,34bf2c6d-8f1f-4e45-b2ff-7a463d5a8ec4,入れてみたもののpayは使ってない
2023-10-04 13:43:03,e2ef8498-ae5e-4e17-94b9-fa2f909a3942,ローソンに負けセブンイレブンもそうだが割引だけするのに誰も足を運ばないよローソンは毎日ポイントを貯めれて引換券と交換できるまずはローソンを見習うべきだな買って初めて割引く
2023-10-04 13:43:03,e2ef8498-ae5e-4e17-94b9-fa2f909a3942,せこい事よ与うるの取るたるを知るは政の宝なり
2023-10-25 01:38:29,7225d1ec-0443-4bd5-a4a9-40741e066ded,ゲームケチだなぁwww
2023-10-05 22:09:25,c008d52e-ce50-4317-8c6e-760949a03a5e,強制更新2023/10/05
2023-10-05 22:09:25,c008d52e-ce50-4317-8c6e-760949a03a5e,ムビチケ購入のため2023/06/02更新
2023-10-19 22:31:03,773dd949-d61f-4049-bc5a-2078b2f35b84,私は南淡北阿万店のオープニングスタッフでした
2023-10-19 22:31:03,773dd949-d61f-4049-bc5a-2078b2f35b84,あの頃は、病気を隠してパートに真浦さん家族が経営するファミマで働きました
2023-10-19 22:31:03,773dd949-d61f-4049-bc5a-2078b2f35b84,御迷惑ばかりおかけして、申し訳ありませんでした
2023-10-19 22:31:03,773dd949-d61f-4049-bc5a-2078b2f35b84,イズビニーチェパジャールスタ岡本淳子オカモトアツコ
2023-10-23 04:43:44,647400bf-58b7-43d1-82c8-fa245ded38a0,楽天カードが何回しても登録できない
2023-10-02 00:19:34,220e37af-0c61-4989-8b2f-d2a61a3840c5,りにててひちつまやねらろかーにまゆう
2023-10-05 12:46:39,374efa63-c461-45fa-aa15-ef2eee429fa0,パスワード変更を何度行ってもパスワード変更画面に移動させられる
2023-10-14 18:12:57,2b638a34-f0a4-40a4-bcb1-4feba41c1c8b,クーポンの期限が近い
2023-10-10 10:58:16,80ba8010-1ba1-4866-815d-6736e8bac414,無料クーポンが何故か100円引き何で
2023-10-07 06:29:43,1b757067-e693-412b-b3df-4c5f41c2d311,アプリをとってもログインできない、最悪
2023-11-26 18:45:29,a115c673-8270-469b-9674-20c8f59891b2,タブレット端末で使っていますがアップデートしてアプリ側でバーコードが大きくなってからレジで読んでもらえず使い物にならず困っていた
2023-11-26 18:45:29,a115c673-8270-469b-9674-20c8f59891b2,バーコードが読めなくてもお店ではバーコードの下の数字を入力するような対応はなく、困りましたねの雰囲気でバーコードを何度もスキャンするだけでした
2023-11-26 18:45:29,a115c673-8270-469b-9674-20c8f59891b2,ローソンならポンタカードのバーコードが読めないときは数字を入力して対応してくれた
2023-11-26 18:45:29,a115c673-8270-469b-9674-20c8f59891b2,ファミマにも同じ様な機能があるだろうと想像するのだがどうなのだろう
2023-11-26 18:45:29,a115c673-8270-469b-9674-20c8f59891b2,周知されていないだけ
2023-11-26 18:45:29,a115c673-8270-469b-9674-20c8f59891b2,サポートに問い合わせても、バーコードを小さくする機能は説明してもらえず、スマホしか対応していない
2023-11-26 18:45:29,a115c673-8270-469b-9674-20c8f59891b2,今まで使えていても、サポート外だからいつ使えなくなるかわからない
2023-11-26 18:45:29,a115c673-8270-469b-9674-20c8f59891b2,だからスマホで使って
2023-11-26 18:45:29,a115c673-8270-469b-9674-20c8f59891b2,と忠告されるだけだった
2023-11-26 18:45:29,a115c673-8270-469b-9674-20c8f59891b2,そもそもandroidのスマホでも全ての機種で動作は保証していないので動けばラッキー、動かなければアンラッキーの状態です
2023-11-26 18:45:29,a115c673-8270-469b-9674-20c8f59891b2,動作確認済みの機種一覧の掲載は見つけられなかった他にコメントされていた方も同じ問題で困っているようなので書いておきます
2023-11-26 18:45:29,a115c673-8270-469b-9674-20c8f59891b2,バーコードでかすぎる問題の解決方法は、2画面表示にするです
2023-11-14 09:54:51,51242e2c-3030-406a-ba0d-8a23bf9da632,色々キャンペーンをするが後払いやローンを勧めてくるので経営苦しいのかな
2023-11-14 09:54:51,51242e2c-3030-406a-ba0d-8a23bf9da632,と逆に心配
2023-11-14 09:54:51,51242e2c-3030-406a-ba0d-8a23bf9da632,銀行チャージは3000円からしか出来ないし不便
2023-11-14 09:54:51,51242e2c-3030-406a-ba0d-8a23bf9da632,googleplayをアプリ内で買うのも仮想クレジットを作らねばならず、嫌厭される機能
2023-11-14 09:54:51,51242e2c-3030-406a-ba0d-8a23bf9da632,500円からgoogleplayを買えるのが強みだったがバリアブルで1000円〜が出た点、ペイペイ購入が可能になったためアドバンテージはなくなった
2023-11-14 09:54:51,51242e2c-3030-406a-ba0d-8a23bf9da632,頻繁にクーポン配ってくれるが元が定価なため、スーパーなどには負ける無料クーポンだけは感謝
2023-11-22 22:17:19,2ba4bca2-7a06-43bf-ab79-47de92cf3fe0,更新してくださいと表示されたので更新したら、バーコードが大きくなってしまいレジでスキャンできなくなってしまいました
2023-11-22 22:17:19,2ba4bca2-7a06-43bf-ab79-47de92cf3fe0,クーポン利用、チャージして請求書支払いしたいのにできません
2023-11-22 22:17:19,2ba4bca2-7a06-43bf-ab79-47de92cf3fe0,更新前はとても便利に使えていたのに、どうすればいいですか
2023-11-22 22:17:19,2ba4bca2-7a06-43bf-ab79-47de92cf3fe0,とても、困っています
2023-11-22 22:17:19,2ba4bca2-7a06-43bf-ab79-47de92cf3fe0,問い合わせしたらタブレットには対応してないと返答されましたが、更新前は普通に使えていたのにおかしくないですか
2023-11-20 12:11:08,79ec6b57-29ca-418f-821c-c7d0d0a90866,キャンペーンの割引がレシートだったりアプリだったりで管理が不便
2023-11-20 12:11:08,79ec6b57-29ca-418f-821c-c7d0d0a90866,アプリ内にあるクーポンは選択しないと使えないのも不便
2023-11-20 12:11:08,79ec6b57-29ca-418f-821c-c7d0d0a90866,自動反映くらいしてくれないものか
2023-11-20 12:11:08,79ec6b57-29ca-418f-821c-c7d0d0a90866,キャンペーンも1ポイントも当たらないことのほうが多くて操作が多い割にはリターンが少ない印象
2023-11-02 07:07:30,420ff843-d6db-419b-900d-2824e9b20dfe,ファミペイの利用がワンタップで認証画面だったのに、ページを移動してスイッチを切り替えないと利用出来ないので以前より使いづらくなった
2023-11-02 07:07:30,420ff843-d6db-419b-900d-2824e9b20dfe,上位に現在使用不可のクーポンの予告が表示されるので下へ何回もスクロールしないと現在使えるクーポンにたどり着かない残念な仕様
2023-11-02 07:07:30,420ff843-d6db-419b-900d-2824e9b20dfe,フィルタも無い〜
2023-11-16 13:35:49,3eac0d7d-3415-47ce-b653-519f8c3d9ce4,ポイントカードとして利用してます
2023-11-16 13:35:49,3eac0d7d-3415-47ce-b653-519f8c3d9ce4,主な機能だけなら★5ですが、通知がとてもうるさい&邪魔で★が4つ減ります
2023-11-16 13:35:49,3eac0d7d-3415-47ce-b653-519f8c3d9ce4,ポップアップ通知をoffに出来ればいいだけなのですがその機能は無く、通知そのものはコラボ企画の当選はプッシュ通知というルールがあるので、消せません
2023-11-16 13:35:49,3eac0d7d-3415-47ce-b653-519f8c3d9ce4,この邪悪なコンボを考えた人間、恨まれても仕方ないです
2023-11-14 15:23:43,0e65cd86-c5a9-49e1-888c-c29d1a4069d0,使いやすいのと、クーポンでも無料のクーポンが時々贈られて来るので一番有難いアプリです
2023-11-14 15:23:43,0e65cd86-c5a9-49e1-888c-c29d1a4069d0,商品検索出来なくても、店舗検索から直接電話で在庫確認します
2023-11-14 15:23:43,0e65cd86-c5a9-49e1-888c-c29d1a4069d0,スタッフの対応も良いので助かります
2023-11-01 07:54:25,3f7c23b4-e1e8-47ac-b5fd-45e9b060ca41,更新-アプリが使いづらくなりました
2023-11-01 07:54:25,3f7c23b4-e1e8-47ac-b5fd-45e9b060ca41,残念です
2023-11-01 07:54:25,3f7c23b4-e1e8-47ac-b5fd-45e9b060ca41,あちこち押さなければならない、使い方を教えてあげてやっと覚えた高齢両親が再度苦戦するハメに、、、チャージしておけば、公共料金を家で支払えるし物凄く便利です
2023-11-01 07:54:25,3f7c23b4-e1e8-47ac-b5fd-45e9b060ca41,ただ絶対に登録した暗証番号は覚えておきましょう
2023-11-06 20:59:32,983afb20-e467-47c4-8128-800d9938451d,エラーがでて問い合わせの電話をしても全くつながらない
2023-11-06 20:59:32,983afb20-e467-47c4-8128-800d9938451d,オペレーターの方々が大変なのは分かるがfamipayでの支払いも出来ない上に通話料まで取られて損した気分
2023-11-24 11:50:15,68056392-7c64-4740-a9fc-c9c50401d39f,毎日食べても飽きないコロッケの味と食感と脂です
2023-11-24 11:50:15,68056392-7c64-4740-a9fc-c9c50401d39f,メンチはゲップの匂いが苦手で食べられませんでしたが、ファミマのメンチは全く気になりませんでしたしどんなお店屋さんで出してるメンチよりも美味しいですよ
2023-11-24 11:50:15,68056392-7c64-4740-a9fc-c9c50401d39f,胃もたれしらずで価値有りだと思います
2023-11-28 21:13:40,ebffa2e6-3144-47c7-92ac-ccfa093ea3d7,クーポンやキャンペーンが地域によって使える使えないか自分で確認しないといけないので面倒
2023-11-28 21:13:40,ebffa2e6-3144-47c7-92ac-ccfa093ea3d7,設定で地域設定してそれで出す情報切り分けできるようにしてほしい
2023-11-27 21:16:39,ee66d8d9-2e09-47dc-a9a7-3afa6153be0c,ポイントの紐付けがどれも登録済みになっていて解除の仕方もわからない
2023-11-27 21:16:39,ee66d8d9-2e09-47dc-a9a7-3afa6153be0c,良いクーポンがあれば使っても良い程度
2023-11-27 21:16:39,ee66d8d9-2e09-47dc-a9a7-3afa6153be0c,ファミペイを使うメリットがわからない
2023-11-10 08:04:43,47a7ea36-305e-45af-8355-817c1a4a0f70,銀行口座を登録するのに自動音声通話使うとか、ファミペイの仕様
2023-11-10 08:04:43,47a7ea36-305e-45af-8355-817c1a4a0f70,それとも銀行側じぶん銀行
2023-11-10 08:04:43,47a7ea36-305e-45af-8355-817c1a4a0f70,パスワード言うまで何でか数秒時間かけるし、それまで発生している通話料が無駄になる
2023-11-10 08:04:43,47a7ea36-305e-45af-8355-817c1a4a0f70,何でsmsではないの
2023-11-10 08:04:43,47a7ea36-305e-45af-8355-817c1a4a0f70,有り得ない
