at,reviewId,content
2023-11-30 21:13:55,562a1495-a87f-411e-b7fe-bb6c06be5ce6,以前は無料クーポンが2週間に1度ほど配布されていたのに、最近は全く配布されなくなりました
2023-11-30 21:13:55,562a1495-a87f-411e-b7fe-bb6c06be5ce6,あと、オートチャージサービスもなくなり不便になりましたねオートチャージのためにファミマカードを作ったのに、出来ないならいつも使いのカードに切り替えて、ファミマカードは解約しようと思います
2023-11-30 21:13:55,562a1495-a87f-411e-b7fe-bb6c06be5ce6,家の側にファミマがあるので、いまは使ってますが、引っ越したらファミペイトとともにファミマも使わなくなりそう
2023-11-11 13:53:52,ae698b4a-f95b-43ab-8f33-d226df110c44,職場の近くのファミマをよく利用しています
2023-11-11 13:53:52,ae698b4a-f95b-43ab-8f33-d226df110c44,スタッフさんが、今日これを買うと次回無料のクーポンがもらえますよと教えてくれます
2023-11-11 13:53:52,ae698b4a-f95b-43ab-8f33-d226df110c44,無料クーポン出るやつはあるかな
2023-11-11 13:53:52,ae698b4a-f95b-43ab-8f33-d226df110c44,と、店内を歩くのが楽しいです
2023-11-21 20:10:49,7cdd2c0a-c7de-4908-87dc-15d9f43b3cf4,あまりにひどい暗証番号ロック解除番号に連絡すると長ったらしい最後まで聞かなきゃいけないナビダイヤルに繋がってさんざん個人情報入力させられた挙げ句、また同じ番号にナビされるっていう無限ループ
2023-11-21 20:10:49,7cdd2c0a-c7de-4908-87dc-15d9f43b3cf4,本当に金返してください
2023-11-21 20:10:49,7cdd2c0a-c7de-4908-87dc-15d9f43b3cf4,詐欺です
2023-11-25 05:01:53,d3e176bc-f2b9-41e5-8638-1cfec625c039,クーポンも便利ですが、お店のサービスが一つ買うともう一つもらえる等スゴイ便利でいつも利用させていただいています
2023-11-30 18:05:12,642dff02-72ef-46b6-8bd3-ef7ccca1f0a7,2回に1回当たるゲームで32回やって8回しか当たらなかった
2023-11-30 18:05:12,642dff02-72ef-46b6-8bd3-ef7ccca1f0a7,当選確率25%ありえない数字なので誇大広告と判断せざるを得ない
2023-11-29 10:32:11,43c07799-3ca5-4dc2-ab8d-ba9e246cc645,他の人も書かれてますが総じて使いにくくなってますねゲームも毎回最初の画面に戻って連続でできなくなってますね
2023-11-23 16:39:27,c3a5cfc2-4cbd-4feb-8e31-71f9ad30e4d2,タブレットで使えるようにしてくださいー
2023-11-23 16:39:27,c3a5cfc2-4cbd-4feb-8e31-71f9ad30e4d2,7インチ8インチだとバーコードデカすぎて読み取れないです
2023-11-24 10:16:50,8ca50c6f-0f84-4014-aae7-cc171c7dbe8a,"他のコンビニではないクーポンなので,このアプリを入れてよかったなと思いました"
2023-11-24 10:16:50,8ca50c6f-0f84-4014-aae7-cc171c7dbe8a,これからもずっと使い続けていくつもりです
2023-11-23 17:32:20,5b4c2a39-f7b2-49c7-b50c-911a0f7d4908,家の近所で毎日使ってます
2023-11-23 17:32:20,5b4c2a39-f7b2-49c7-b50c-911a0f7d4908,ゲームでポイントなど貯まったりファミペイに入金しておくと自然と貯まります
2023-11-23 17:32:20,5b4c2a39-f7b2-49c7-b50c-911a0f7d4908,便利ですよ
2023-11-12 09:48:07,d0b1a446-2def-4ad1-b004-33145643bfb8,ファミマアプリは子供が小学生の時から使ってます
2023-11-12 09:48:07,d0b1a446-2def-4ad1-b004-33145643bfb8,お財布を忘れた時は凄く便利ですがスマホ忘れたら使えないのでスマホを持って歩いてます
2023-11-12 09:48:07,d0b1a446-2def-4ad1-b004-33145643bfb8,ポイントも貰えて凄く便利なアプリです
2023-11-12 09:48:07,d0b1a446-2def-4ad1-b004-33145643bfb8,私の家の近くのコンビニはファミマです
2023-11-07 13:14:32,2a5edfd6-b004-4742-8f0c-3d9e298bd1f7,コンビニはもう生活の1部
2023-11-07 13:14:32,2a5edfd6-b004-4742-8f0c-3d9e298bd1f7,せっかく利用するならお得な情報やクーポンが付いてくるアプリを使わなきゃ勿体ない
2023-11-07 13:14:32,2a5edfd6-b004-4742-8f0c-3d9e298bd1f7,ファミペイアプリは特に使いやすいからオススメです☆
2023-11-16 06:55:43,03b4f082-e54e-478e-ab16-d788857f5789,レシートクーポンありがたいが、アプリ内のクーポンにも同一のものを追加して欲しい
2023-11-16 06:55:43,03b4f082-e54e-478e-ab16-d788857f5789,例えば、今ならホットドリンク50円引き
2023-11-03 01:25:40,cb1c7ff0-ab84-4edf-825a-1192f56d71c1,更新頻度が高すぎる
2023-11-03 01:25:40,cb1c7ff0-ab84-4edf-825a-1192f56d71c1,しかも更新されてないとお店で使えないとゆう謎仕様
2023-11-01 05:56:18,7e6a9a15-9052-40f5-8e26-27f7c802af57,最近ファミペイを使いはじめて、とても便利で有難いです
2023-11-01 05:56:18,7e6a9a15-9052-40f5-8e26-27f7c802af57,皆様のご利用をお勧め致します
2023-11-03 15:22:56,1ed42441-cf53-43e1-9d5f-1172ba1468f5,クーポンをセットしてもチャージするとリセットされてしまうようで、再度セットしないといけない
2023-11-19 13:57:21,42afe54c-8847-49f3-92bd-61a98063ede5,楽天ベイと連動できるのが嬉しい
2023-11-19 13:57:21,42afe54c-8847-49f3-92bd-61a98063ede5,1度しか使えないクーポンが何度も配布されるのは、紛らわしいので-★1
2023-11-22 08:34:45,82b04c26-7377-4bde-93fa-4464f8794657,今日、銀行口座からチャージしようとしたら登録してあった銀行口座が消えてました
2023-11-22 08:34:45,82b04c26-7377-4bde-93fa-4464f8794657,11月10日にはできていたのに
2023-11-22 08:34:45,82b04c26-7377-4bde-93fa-4464f8794657,何かしらアナウンスしろよな
2023-11-06 20:42:03,a2135b14-674b-4128-af61-334f139a55e2,メルカリの支払いに使っていたのですが残高は足りているのにシステムエラーやセッションの有効期限がなどとでてログインが出来ません
2023-11-24 16:13:59,756273b1-4b8c-43c4-98d8-4b209d231acd,googlepixelに機種変してから起動ができなくなりました
2023-11-01 02:26:08,8a51a344-67a9-4913-9235-bcca322fd13e,番号変えたらtポイント登録出来ない番号変更使って無いと判断したら登録又できるようにして欲しいヘルプのは全部しました
2023-11-04 16:19:43,786240ea-6b83-4f9a-b2a4-800047bbfbd9,最初は良かったがだんだんメリットがショボくなってきた、興味あるキャンペーンも最近少ない
2023-11-30 20:59:31,ba558365-13bb-4d92-80b1-c2e2128bf7bf,いつもパチンコ帰りに寄らせて頂いてます夜食作らなくてもすぐ食べれるのが素敵です
2023-11-15 05:38:30,1c4dd08d-65c4-4ab8-8d91-3581a77063af,キャッシュレスでポイントアップ、クーポンもあって、コレは使わん手は無いでしょう
2023-11-20 03:46:45,1847b270-4173-41e1-8cec-7d3f9a977a74,もっと当たり金額が、高ければ頻繁に行くのになぁ
2023-11-20 03:46:45,1847b270-4173-41e1-8cec-7d3f9a977a74,1円じゃショボすぎ
2023-11-28 11:12:55,711fcfc7-17d0-4d4d-8ba5-fd05f30476cc,店頭支払いなら、単純に使いやすい
2023-11-15 20:23:52,f82dd31b-0cb8-4ab2-8aa0-9cca43e543f5,必須入力項目として、電話番号はともかくとして、秘密であるパスワードも必須なのは
2023-11-07 12:46:12,c7f25d72-ce9f-409a-8be0-7a5d20f59cdb,色々と、便利使いやすいポイント、ゲームも、楽しい
2023-11-01 23:16:00,f03096f5-f0d5-4cf9-b097-50e6a46f8ff8,アップデートしてから電話番号変更コードが取れなくなり機種変更後の端末で使用できない
2023-11-19 07:54:03,3ced4f0b-1113-4d8d-b1d7-6e4812d78713,いちばん使っているアプリかな
2023-11-19 07:54:03,3ced4f0b-1113-4d8d-b1d7-6e4812d78713,お得がたくさんあるのが嬉しいです
2023-11-14 18:14:08,9231664f-64e2-412c-9daf-16ca48b5f3ec,チャージしておくと便利でお得です
2023-11-10 12:22:56,46ba129d-0d0d-488c-a6cf-03ac8f33128d,起動が遅い公式アプリがレジで時間かけてどうするねん
2023-11-17 21:57:33,bb13ad14-3298-4d26-b31a-38e77ae5c599,ホームコンビニがファミマなのでいつも利用させていただいてますビールやお菓子など無料クーポンがけっこう貰えます
2023-11-23 09:36:59,74f8a5de-1af8-4fa0-a774-ed8acc071fd5,便利で分かりやすい
2023-11-21 14:06:36,d0c8c089-a6c7-4af6-85f8-9c99103b9753,交換チケットが、アプリに入るのが良かった
2023-11-29 21:15:19,f8281c53-496b-4ca5-a170-451aeb5ff18e,毎週無料クーポンが楽しみです
2023-11-19 06:44:46,66e02b06-ff02-45fa-b279-de17206a79ab,適度なバランスコンビニ
2023-11-10 11:04:09,87326d47-8398-4de2-9a67-5beb515c392a,データ専用simのスマホでは使えない
2023-11-13 10:50:26,13370ea9-b033-441c-a33a-2436004f9c22,あまり良いクーポンもないしくじも当たらない
2023-11-29 11:43:59,da8dfaf7-03f3-4b70-b11e-3175743897eb,ファミペイで無料で先日sapporo黒ラベルのロング缶のクーポンが届いたよ
2023-11-29 11:43:59,da8dfaf7-03f3-4b70-b11e-3175743897eb,1000円から課金が出来てかなりお得感ありますよ
2023-11-28 10:13:24,256ba1c6-f16f-44d5-859c-672599e9d2f2,新作が発売されると、直ぐに無料クーポンが貰えて助かります
2023-11-30 01:01:13,a8fd69b3-6981-47f2-8174-8c8fbe2efcea,たまにだが、アルコールくれます
2023-11-30 01:01:13,a8fd69b3-6981-47f2-8174-8c8fbe2efcea,コンビニアプリでも一番良い
2023-11-28 22:37:17,6be3f102-fc6e-43c6-8b49-7a2ede87d85f,早くマイナンバーカードの公的個人認証を導入してください
2023-11-28 22:37:17,6be3f102-fc6e-43c6-8b49-7a2ede87d85f,カードの写真撮ったり、顔を何度も撮影したり不便すぎます
2023-11-04 16:34:32,e312f1f7-6726-4424-a7b9-068985983c04,最高
2023-11-04 16:34:32,e312f1f7-6726-4424-a7b9-068985983c04,クーポンと楽天経済圏防がないでね
2023-11-01 14:46:02,95ca1f16-fc0b-468f-bd35-cffc736ccbcc,ファミマのレジ前でフリーズして、立ち上がらない粗悪アプリ
2023-11-08 22:05:38,39833210-da07-49ae-8946-c9d8c3a474f3,ファミペイがコンビニの中で一番使いやすいし、クーポンもいい
2023-11-02 18:51:45,114d29c4-7462-4976-a5fe-92c469787105,近くに、合ってとても、bestですよ❢此れからも宜しくお願いします
2023-11-08 07:37:07,453220f7-c2cb-4d77-86aa-7d877f58a423,使いやすい、めんどくさくないからいい
2023-11-01 12:39:40,3f4140a2-7337-419a-bc49-a08023ae95d7,使おうとするとアップデートがかかる、使う気になれない
2023-11-11 23:42:29,01bb6845-d10b-4380-8895-8ff78b52aab6,此れから利用させて頂きます
2023-11-11 23:42:29,01bb6845-d10b-4380-8895-8ff78b52aab6,便利ですね
2023-11-02 17:40:54,fd2ce777-52bf-4244-b6e6-a3b649878191,電話番号認証しないと利用できません
2023-11-02 17:40:54,fd2ce777-52bf-4244-b6e6-a3b649878191,確認コードを受信してメッセージアプリを開きこちらのアプリに戻り確認コードを入力しようとしたら初期画面にリセットされ登録できませんでした
2023-11-06 18:07:42,ab0e7eec-157c-4e9b-beb3-831ee9cee9ae,本人確認がなかなかできない
2023-11-06 18:07:42,ab0e7eec-157c-4e9b-beb3-831ee9cee9ae,マイナンバーカードの写メ送ってもなんぞかんぞ理由つけて、登録させない
2023-11-06 18:07:42,ab0e7eec-157c-4e9b-beb3-831ee9cee9ae,何度もやり直しさせる
2023-11-06 18:07:42,ab0e7eec-157c-4e9b-beb3-831ee9cee9ae,いい加減にしろ
2023-11-12 00:57:10,c17a22fe-b684-4f2c-88f8-a448995b6d98,2023年10月30日アプデしたら勝手にログアウトされました
2023-11-12 00:57:10,c17a22fe-b684-4f2c-88f8-a448995b6d98,携帯電話解約したからログインできないです
2023-11-12 00:57:10,c17a22fe-b684-4f2c-88f8-a448995b6d98,残高返せ
2023-11-12 00:57:10,c17a22fe-b684-4f2c-88f8-a448995b6d98,あり得ないでしょ
2023-11-14 11:25:25,62139d3a-9728-41cc-bfdd-a146a267a821,たまーにくれるクーポン最高です
2023-11-14 11:25:25,62139d3a-9728-41cc-bfdd-a146a267a821,大満足
2023-11-14 14:55:33,e9411f74-6430-4478-a0b5-5e203495213d,クーポン配信されてお得感があります
2023-11-05 18:36:30,8a2b7af1-a25c-4686-8392-5c41d7bb7bd3,情報がゆ和よくわからない
2023-11-10 12:17:26,1f4f41b2-391c-4539-a030-4e727ec44922,他社、ポイントカードと連係し、クーポンも良い
2023-11-30 23:20:07,490e88ca-9ba5-4997-ba7a-2bfb5739cece,使いやすいと思います
2023-11-08 11:35:11,0adee822-ea4b-4996-8dc8-49ef94f9a553,無料クーポンの内容がスゴすぎる
2023-12-09 04:21:43,b21168ba-c8ac-4673-85d7-7b384f65359b,読み終わってるメッセージ
2023-12-09 04:21:43,b21168ba-c8ac-4673-85d7-7b384f65359b,恐らくは過去メッセージ40件以上有るのに何故かトップのベルアイコンは17件の表示はこちらの物と思われるがいつまでも前までのメッセージ数がカウントされたままで新しいメッセージが来るとそこにそのメッセージ数がカウントされる
2023-12-09 04:21:43,b21168ba-c8ac-4673-85d7-7b384f65359b,例:過去メッセージ17先にも触れたが40件以上有るのにココに新たなメッセージが2件来ると19になってそれを既読するとまた17に戻る、つまり新たに来た物がカウントされて増えて既読するとそれだけが減ると言う謎の仕様
2023-12-09 04:21:43,b21168ba-c8ac-4673-85d7-7b384f65359b,と、言うかマトモな物をリリースしろや
2023-12-15 12:27:56,c1852186-15f8-4e6a-a329-84c1d01e7477,アップデート後なのかな
2023-12-15 12:27:56,c1852186-15f8-4e6a-a329-84c1d01e7477,出勤前8時半ぐらいに毎日ぐらい使ってますが、立ち上げにめっちゃ時間かかる
2023-12-15 12:27:56,c1852186-15f8-4e6a-a329-84c1d01e7477,それに回数券を、表示するまでもクルクルずっと読み込んで、何回もエラーがあったり
2023-12-15 12:27:56,c1852186-15f8-4e6a-a329-84c1d01e7477,店舗入ってから、5分ぐらいかかってやっとレジができるって
2023-12-15 12:27:56,c1852186-15f8-4e6a-a329-84c1d01e7477,ヤバいと思う
2023-12-15 12:27:56,c1852186-15f8-4e6a-a329-84c1d01e7477,朝だけいつも遅いので、改善を求めます
2023-12-15 12:27:56,c1852186-15f8-4e6a-a329-84c1d01e7477,それと立ち上げから、回数券までの表示をもっと簡単にして
2023-12-15 12:27:56,c1852186-15f8-4e6a-a329-84c1d01e7477,立ち上げ→ホーム→クーポン→回数券→セットする→ホーム面倒くさすぎるし、すごく時間かかります
2023-12-15 12:27:56,c1852186-15f8-4e6a-a329-84c1d01e7477,朝の急がしい時間の一手間をなんとかして下さい
2023-12-20 14:06:32,0baf3296-e31c-4bb8-9677-78f5753972bb,自社ペイアプリなので他のコンビニに比べて、アプリ配信割引クーポンの使い勝手がよい
2023-12-20 14:06:32,0baf3296-e31c-4bb8-9677-78f5753972bb,割引バーコード別に出すのって忘れるんですよね
2023-12-20 14:06:32,0baf3296-e31c-4bb8-9677-78f5753972bb,後は課金用やネット買い物にバーチャルクレカ使ってます
2023-12-20 14:06:32,0baf3296-e31c-4bb8-9677-78f5753972bb,ハ○ロー何かに比べボーナスペイのゲームもすぐ結果がわかるから当たらなくてもストレスを感じない
2023-12-20 14:06:32,0baf3296-e31c-4bb8-9677-78f5753972bb,問題は個人的にファミマで買う機会が少なくなったことと、チャージ特典の改悪かなぁ
2023-12-17 03:09:26,427aca9c-2fd1-4af8-bf2a-1c97b5186841,消せない広告まででかでかと出してきてますます不愉快
2023-12-17 03:09:26,427aca9c-2fd1-4af8-bf2a-1c97b5186841,更新強要される
2023-12-17 03:09:26,427aca9c-2fd1-4af8-bf2a-1c97b5186841,色々不愉快
2023-12-17 03:09:26,427aca9c-2fd1-4af8-bf2a-1c97b5186841,自社の広告だらけで不愉快
2023-12-17 03:09:26,427aca9c-2fd1-4af8-bf2a-1c97b5186841,しつこすぎる
2023-12-17 03:09:26,427aca9c-2fd1-4af8-bf2a-1c97b5186841,チャンスと言う言い方も不愉快
2023-12-17 03:09:26,427aca9c-2fd1-4af8-bf2a-1c97b5186841,ポイントカードを登録しているのにいつの間にかポイント付かなくなっていて9回目にたまたま気づいてポイントが付くように元に戻した
2023-12-17 03:09:26,427aca9c-2fd1-4af8-bf2a-1c97b5186841,8回分ポイント付いてない
2023-12-17 03:09:26,427aca9c-2fd1-4af8-bf2a-1c97b5186841,ひどい
2023-12-17 03:09:26,427aca9c-2fd1-4af8-bf2a-1c97b5186841,アプリを使わなければ付いたのに
2023-12-17 03:09:26,427aca9c-2fd1-4af8-bf2a-1c97b5186841,ひどすぎる
2023-12-07 08:23:54,76c22355-d916-453e-9986-eafc22561ece,だいぶ前からクジが全く当たらなくなった
2023-12-07 08:23:54,76c22355-d916-453e-9986-eafc22561ece,なるべくファミマのつもりがファミマじゃ無くて良くなった
2023-12-07 08:23:54,76c22355-d916-453e-9986-eafc22561ece,デジタル領収はどこ行きました
2023-12-07 08:23:54,76c22355-d916-453e-9986-eafc22561ece,少し前に買ったiqosのユーザー登録してなかったからいつ買ったか知りたかったのにデジタル領収が無い
2023-12-07 08:23:54,76c22355-d916-453e-9986-eafc22561ece,使った金額は解るけど詳細はどこ
2023-12-07 08:23:54,76c22355-d916-453e-9986-eafc22561ece,見てた場所から無くなった
2023-12-07 08:23:54,76c22355-d916-453e-9986-eafc22561ece,見つけれないだけ
2023-12-07 08:23:54,76c22355-d916-453e-9986-eafc22561ece,もし詳細を無くしたならやめて欲しい
2023-12-07 08:23:54,76c22355-d916-453e-9986-eafc22561ece,レジ打ち間違いが多いのに
2023-12-07 08:23:54,76c22355-d916-453e-9986-eafc22561ece,5連連なった100円ちょいのお菓子をバーコード5コ付いてるから×5でとられる所だったし割引がされてない事もよくあるのに無いと困る
2023-12-07 08:23:54,76c22355-d916-453e-9986-eafc22561ece,いずれも店出たり家に帰ってから気づいたから後から対応してもらったけど
2023-12-07 08:23:54,76c22355-d916-453e-9986-eafc22561ece,レシートを保存しとかないとダメになった
2023-12-07 08:23:54,76c22355-d916-453e-9986-eafc22561ece,もしほんとに領収書が無くなってるなら無くなる事をユーザーが分かるように承諾か通知は欲しかった
2023-12-17 21:17:01,b6a73a1a-549b-4489-9733-4ef1369e9896,ファミマで買い物する時、ファミマ以外では還元あり請求書払いが封じられている時、強めの還元率キャンペーン開催中の時以外では使っていない
2023-12-17 21:17:01,b6a73a1a-549b-4489-9733-4ef1369e9896,支払手段の一番手ではなく、消去法的に辿り着くことが殆どだが、入れておいて役立つタイプ
2023-12-17 21:17:01,b6a73a1a-549b-4489-9733-4ef1369e9896,時々、無料クーポンが入っているのが地味に嬉しい
2023-12-15 17:55:57,8a9fbb44-96df-4101-b0f9-faffe7a1894e,ファミマに行かなければ使わなくて良いアプリだが使わなくても入れている
2023-12-15 17:55:57,8a9fbb44-96df-4101-b0f9-faffe7a1894e,アプリが始まってから今までわずか2回だけチャージ1000×2更新されては使いづらくなり今はポイントも残金に合わさっちゃう始末でポイントが見えなくなり2度とチャージしないし使わない
2023-12-15 17:55:57,8a9fbb44-96df-4101-b0f9-faffe7a1894e,入れてるだけでメリットはあるから放置
2023-12-19 11:24:30,5501b612-1477-4ec7-b235-11e70483f581,ファミペイの暗証noが登録した数字を入力したのに、認証出来なくなっている、その前日にクレジットで、3000円入金出来ているのに、暗証no
2023-12-19 11:24:30,5501b612-1477-4ec7-b235-11e70483f581,何回か試していると、ロックがかかって、挙げ句の果てに、ロック解除のナビダイヤルも、使い物にならない、最低、最近のセキュリティは、本人を信用出来ないシステムになっている、アホなaiやめてほしい
2023-12-05 00:41:27,76e4c40c-1a6b-42c6-ac61-be16a2800f95,オートチャージが便利で使ってたけど、いつの間にかオートチャージできなくなってた
2023-12-05 00:41:27,76e4c40c-1a6b-42c6-ac61-be16a2800f95,ファミペイ翌月払いを執拗に勧めてくるが、クレジット払いには対応しておらず、個人情報の入力まで求められる
2023-12-05 00:41:27,76e4c40c-1a6b-42c6-ac61-be16a2800f95,ファミペイ使うためにファミマtカード作ったのに、意味がわからない
2023-12-05 00:41:27,76e4c40c-1a6b-42c6-ac61-be16a2800f95,カード作るときに個人情報の提出や信用審査もやってるのに
2023-12-05 00:41:27,76e4c40c-1a6b-42c6-ac61-be16a2800f95,大手コンビニだとファミマが一番好きだけど、アプリが糞仕様なのが残念すぎる
2023-12-12 14:59:35,78ded3bb-6f3d-43fe-ac37-e9835b9528ba,使い易く商品の割り引きや無料で提供される物もありファミマ好きの者としましては良いアプリだと思いますです欲を言えば、商品のラインナップを増やしてもらえれば良いのですが・・・毎年クリスマスにはファミマへ行き店頭で三種の○○○等を頼んでましたが
2023-12-12 14:59:35,78ded3bb-6f3d-43fe-ac37-e9835b9528ba,今年からはアプリを使わせて貰い助かって折りますです追伸:直接アプリとは関係ない事ですが
2023-12-12 14:59:35,78ded3bb-6f3d-43fe-ac37-e9835b9528ba,入店した計りなのかは分りませんが、店員さんがアプリの使い方を知らなかったのにはちょっと呆れ驚きましたけどね・・・
2023-12-09 19:41:26,06c61309-2c71-4bf7-b75a-a259826f4b84,使えるカード、銀行口座が少ないです
2023-12-09 19:41:26,06c61309-2c71-4bf7-b75a-a259826f4b84,地方銀行は全滅
2023-12-09 19:41:26,06c61309-2c71-4bf7-b75a-a259826f4b84,クレカも、jcb系列しか使えませんでした
2023-12-09 19:41:26,06c61309-2c71-4bf7-b75a-a259826f4b84,ゆうちょ銀行とかであれば使えます
2023-12-09 19:41:26,06c61309-2c71-4bf7-b75a-a259826f4b84,自分は主にポイント用に使用しようかなと思います
2023-12-09 19:41:26,06c61309-2c71-4bf7-b75a-a259826f4b84,決済と店頭チャージは簡単なので、星3にしました
2023-12-09 19:41:26,06c61309-2c71-4bf7-b75a-a259826f4b84,以下、2023/12/09更新ファミペイポイント貰えるイベントものですが、デイリーのチャレンジの演出が無駄に長いので演出スキップの実装をずっと待ってますが中々来ないのでこちらに書かせて頂きます
2023-12-09 19:41:26,06c61309-2c71-4bf7-b75a-a259826f4b84,カードも未だにjcbしか使えないので、星2に変更します
2023-12-08 18:10:09,0072f512-1aa7-47c7-94d0-8ed96bb9a3a1,最近更新してから、急にデータ通信量が増えたのですが何を通信してるんでしょうか
2023-12-08 18:10:09,0072f512-1aa7-47c7-94d0-8ed96bb9a3a1,支払いのたびに数十mbも通信されるのは困りますね
2023-12-08 18:10:09,0072f512-1aa7-47c7-94d0-8ed96bb9a3a1,これなら他の支払い方法を選ばざるを得ません
2023-12-08 18:10:09,0072f512-1aa7-47c7-94d0-8ed96bb9a3a1,アプリのデザインも変わって使いづらくなり残念です
2023-12-14 08:09:44,9b86c954-2c2f-40e6-8b6b-a6503a478b3b,通知の仕様が迷惑すぎる
2023-12-14 08:09:44,9b86c954-2c2f-40e6-8b6b-a6503a478b3b,ゴミ同然のクーポンの知らせのために他のアプリよりも盛大な通知をしてくるなよ
2023-12-14 08:09:44,9b86c954-2c2f-40e6-8b6b-a6503a478b3b,あと、uiが崩壊してる
2023-12-14 08:09:44,9b86c954-2c2f-40e6-8b6b-a6503a478b3b,チャットボットもオペレーターも品質が酷い
2023-12-03 16:35:17,df6639fa-c0e4-49ad-8a6a-77dbe183c2af,ファミペイチャージの入金方法で手持ちのクレジットカードが対応していない
2023-12-03 16:35:17,df6639fa-c0e4-49ad-8a6a-77dbe183c2af,基本的に決済系情報は紐付けたくない
2023-12-03 16:35:17,df6639fa-c0e4-49ad-8a6a-77dbe183c2af,セルフレジや専用ポートでチャージできるようになれば使いやすいのに
2023-12-02 13:44:27,ea3ee0ce-1c01-40b5-9088-eeb473cec043,大好き
2023-12-02 13:44:27,ea3ee0ce-1c01-40b5-9088-eeb473cec043,スイーツ、パンもおにぎりも全部自分好みのものばかり
2023-12-02 13:44:27,ea3ee0ce-1c01-40b5-9088-eeb473cec043,どこかのコンビニと違い値段にあった質と量
2023-12-02 13:44:27,ea3ee0ce-1c01-40b5-9088-eeb473cec043,アプリ使いやすいうえにレシートのqrコードですぐクーポンとれるとこも一番超便利
2023-12-02 13:44:27,ea3ee0ce-1c01-40b5-9088-eeb473cec043,なんでもっと早くアプリいれなかったのかと後悔してる
2023-12-19 18:32:00,aa7a2c35-efa8-4e44-ab0b-f7efcfa77ff7,常にクーポンが貰えるし、ロールティシュやらパンやらお菓子やら50円引きとか100円引きが遣える
2023-12-19 18:32:00,aa7a2c35-efa8-4e44-ab0b-f7efcfa77ff7,たまに太っ腹なファミマアプリは無料でファブリーズや洗剤や電子タバコにファミマルのペットボトルのお茶貰えるし、lucky
