at,reviewId,content
2023-12-19 18:32:00,aa7a2c35-efa8-4e44-ab0b-f7efcfa77ff7,更に普通のdocomopoint登録すると2重にpoint付くので便利
2023-12-19 18:32:00,aa7a2c35-efa8-4e44-ab0b-f7efcfa77ff7,毎日無料ゲームしますと地道にpoint貯まるし、コンビニ好きな方は必ずインソールすべきです
2023-12-19 18:32:00,aa7a2c35-efa8-4e44-ab0b-f7efcfa77ff7,最近はコンビニはファミマしか行かないです
2023-12-19 18:32:00,aa7a2c35-efa8-4e44-ab0b-f7efcfa77ff7,因みに2重point貯まるのはtポイントカードor楽天paydocomopointのみです
2023-12-19 18:32:00,aa7a2c35-efa8-4e44-ab0b-f7efcfa77ff7,auとsoftbankの方は普通のpointカードでもクレカの方もpoint2重取り出来ないので
2023-12-15 16:00:06,62802ab1-9614-4a0f-92c6-82d3b184bf7c,アプデしてからかは分かりませんが、クーポンをセットして支払いの為だけにアプリをちょっとしか開いていないのに以前と比べて通信量が10倍ほど多くなった1回につき70〜80mbって
2023-12-15 16:00:06,62802ab1-9614-4a0f-92c6-82d3b184bf7c,ファミマ使いたくなくなった
2023-12-01 14:37:49,86c8f514-fc99-4caf-bb67-49251e4c9767,使いこなせるとお得なことが多いレジでお店の方に教えていただくことが多いので高齢者にも使いこなせるように告知活動をしていただけると嬉しいです
2023-12-19 18:12:56,bb0f3c70-9258-4a87-bc38-7cd08ed2d2cd,近々のアップデートからかデータ通信量がとんでもなく上がった
2023-12-19 18:12:56,bb0f3c70-9258-4a87-bc38-7cd08ed2d2cd,トップページにデータ量が重いものを置かないでほしい
2023-12-16 16:01:18,57f6e6c4-6eee-4e0a-9e62-55f9fe765598,日常コンビニ使用及び税金等を払うのにも使用しているので、チャージ上限10万翌月払い10万を併用してもでは足りないことがあるので、早く解除して欲しいです
2023-12-19 10:29:10,42b2571f-438e-449e-b516-cdd734cfe1de,最近、口座からチャージしたらクルクル状態で戻ってこない
2023-12-19 10:29:10,42b2571f-438e-449e-b516-cdd734cfe1de,一旦アプリを落として再起動すればチャージされているからまだいいが
2023-12-19 00:59:34,422db950-29b4-4e78-8274-bdc3d5a31ead,クーポン配布とか銀行からチャージとかできて便利毎日ミニゲームでたまに1円分のポイントとか1度だけだけど10円とか当たって楽しいファミペイで買い物すると別のミニゲームでまたポイントもらえたりして楽しいけどファミマのカードローンのセールがたまにしつこいかな
2023-12-15 22:08:35,fb572ecb-2052-42d2-9a8c-a533b045dee7,アプリを開く度に20mb程度の通信が発生する様になった
2023-12-15 22:08:35,fb572ecb-2052-42d2-9a8c-a533b045dee7,気がつけば今月ファミペイだけでモバイルデータ1gb消費してしまった
2023-12-17 10:33:29,0f5b71c1-ffc3-4a56-aa4d-448289eb2c62,wi-fi必須最近のアップデートで通信量が急に増えて、貯まるポイントよりスマホのプラン変更のほうが高くつきそうな勢いで通信してくれる
2023-12-06 13:50:42,1101ac3f-c2d9-4498-90ff-3b1cf0e67a44,遅い、起動に失敗することが多いメニューがわかりにくいサポートが悪いサイト毎の内容が異なるファミマtカードとの組合せでチャージが安心意外と色々なところで使える
2023-12-07 16:46:47,ee13c7d2-05d5-48dd-926e-a0adbda11cf5,他のアプリは普通にバーコード使えるのに、ファミペイだけ使えなくなってる
2023-12-07 16:46:47,ee13c7d2-05d5-48dd-926e-a0adbda11cf5,通知された割引クーポンも使えなくて、残念でした
2023-12-06 18:49:21,d0570497-0474-4b44-8c1e-fe918137dc70,アプリの更新で色々配置がかわったり以前まであった電子レシートが無くなったのか見つからず非常に不便になった
2023-12-09 05:39:06,3a7f97d8-b38c-414e-a3e3-cdf86b0e2cd9,新しいチャレンジページは、何かを動作させると必ずチャレンジ前タブになるので、いちいち切り替えるのが面倒くさい
2023-12-10 21:27:18,011d9a3e-2acc-4741-90b3-f096288bda5c,登録したくても認証コードが届かない
2023-12-10 21:27:18,011d9a3e-2acc-4741-90b3-f096288bda5c,設定や色々見直してもこのファミマだけ来ない
2023-12-10 21:27:18,011d9a3e-2acc-4741-90b3-f096288bda5c,他のは何の問題もなくコードは届くのに謎笑
2023-12-05 20:53:44,992b7e1f-5237-48ec-b4f1-a01423503492,レシートの詳細が急に見られなくなった
2023-12-05 20:53:44,992b7e1f-5237-48ec-b4f1-a01423503492,どんな買い物をしたか、内容が見れないのはおかしくないですか
2023-12-07 08:17:38,33ae3558-8bac-4a4a-9f9a-187504b441f2,時折入る情報に、お店に行かなきゃ
2023-12-07 08:17:38,33ae3558-8bac-4a4a-9f9a-187504b441f2,ってなってお得に買い物しています
2023-12-20 12:17:16,cc5b3ba9-66ea-4bee-915c-c0491800a6d1,通信量が異様に多い
2023-12-20 12:17:16,cc5b3ba9-66ea-4bee-915c-c0491800a6d1,1日に数分しか起動しないのに月半ばで600mbもデータを食うマトモな決済アプリじゃあり得ない
2023-12-18 22:41:54,fa4efbef-abf3-4944-802f-92d9682e8976,無料クーポンはうれしいが、4店廻っても陳列すらないものを無料といわれてもなんかバカにされてる感じがするので星は1つです
2023-12-08 10:50:31,a2dfc43f-6ff6-4d35-8dad-1bc8aa229f20,情報のバッヂが邪魔です
2023-12-08 10:50:31,a2dfc43f-6ff6-4d35-8dad-1bc8aa229f20,アプリでの通知はオフにしているのにバッヂかつきっぱなし
2023-12-14 10:55:17,fa499ec9-1803-4cca-8b8c-f63fd029d600,きちんと初期設定しないと大音量で通知してくる他は振動する程度
2023-12-14 10:55:17,fa499ec9-1803-4cca-8b8c-f63fd029d600,不親切なアプリ
2023-12-02 18:26:47,40cc6733-6471-4fd0-8666-af1d5aa30352,いつの間にかポイント連携が解除されていて、とっさに使えなかった
2023-12-08 08:54:03,4d15299e-34a2-4284-9198-2a2e82cb5898,ファミマカードを登録しているのに、オートチャージがメニューから無くなって、できなくなった
2023-12-15 07:42:27,b586b4a3-0627-424d-87e4-c3169c38f19d,アップデートで使いづらくなってしまいました
2023-12-15 07:42:27,b586b4a3-0627-424d-87e4-c3169c38f19d,特にチャレンジが・・・
2023-12-20 20:46:37,5eaf1acc-f784-4e1b-8d6f-79f66a5e3f1a,ずっと使ってなかったのにバックグラウンド起動通信しまくって電池とパケット消耗させられてる
2023-12-20 12:17:18,517baf78-bb26-47de-be18-469b6f533e9a,もっとお得になってほしいですけど、使いやすさ、わかりやすさは充分です
2023-12-15 00:40:04,f82c2580-f0d4-43d0-86af-6ce6c0b7bd15,アンインストールしました
2023-12-15 00:40:04,f82c2580-f0d4-43d0-86af-6ce6c0b7bd15,本格的に利用していこうとしてましたが本人確認を何回しても出来ません
2023-12-15 00:40:04,f82c2580-f0d4-43d0-86af-6ce6c0b7bd15,写真の写りが悪いやらな何やら、毎回違う理由を付けてその都度、1からやり直し
2023-12-15 00:40:04,f82c2580-f0d4-43d0-86af-6ce6c0b7bd15,他の証券口座開設やふるさと納税納付は全てパスしてるのに
2023-12-15 00:40:04,f82c2580-f0d4-43d0-86af-6ce6c0b7bd15,また問い合わせフォームの返事も遅い上に不適切
2023-12-15 00:40:04,f82c2580-f0d4-43d0-86af-6ce6c0b7bd15,疲れました
2023-12-07 19:54:22,67954b3e-0c37-4072-b2ef-cc77a2f14869,チャレンジが分かりにくくなった
2023-12-07 19:54:22,67954b3e-0c37-4072-b2ef-cc77a2f14869,以前の方がよかった
2023-12-12 08:38:58,a4eddaed-c9f8-40db-9878-21e7d3739114,皆さんすごいですね
2023-12-12 08:38:58,a4eddaed-c9f8-40db-9878-21e7d3739114,使いこなしてる感
2023-12-12 08:38:58,a4eddaed-c9f8-40db-9878-21e7d3739114,自分は使い方そのものがわからなくて諦めました
2023-12-10 13:31:14,01d44779-38bc-40c0-84de-eca5f7bf3529,配信の自分が使えるクーポンがもう少し配信されると嬉しく思います
2023-12-01 17:17:05,2a32140f-2565-40b4-bd2e-1f79e0e8e20b,お得なキャンペーンの商品内容が魅力
2023-12-03 11:06:55,2c73abc7-854b-4b45-a51f-26f59235a739,ファミマスイーツクーポン助かってます
2023-12-03 11:06:55,2c73abc7-854b-4b45-a51f-26f59235a739,王道のショコラ系も好きですが、最近フロランタンにはまってます
2023-12-06 04:38:18,c3371afb-5b9e-4028-a2a9-8101b5eec517,毎日ポイント当たるチャンスやたまに無料クーポンが配布されてお得です
2023-12-07 23:30:39,c6d767bc-e035-4e23-babc-1353abc35484,お知らせを見ても既読数が減らない
2023-12-07 23:30:39,c6d767bc-e035-4e23-babc-1353abc35484,メッセージの消去機能がほしい
2023-12-06 18:01:46,cf5f342d-9dc3-412d-bb35-9322e403611c,今回のアップデート別に変えなくてもいいんじゃないの不便になりましたと金曜日のファミペイチャージで割引クーポンまたやって欲しいかなの星減りですかね
2023-12-14 16:32:33,6b8824de-53d0-4f19-8385-fed5666ce194,ファミペィ使いやすいです
2023-12-14 16:32:33,6b8824de-53d0-4f19-8385-fed5666ce194,商品も豊富です
2023-12-10 12:56:45,39a624bb-2f04-44a3-8ae5-3333eba0d256,シャープのsimフリースマホsh-m26で使用インストールはでき、初期画面は表示される
2023-12-10 12:56:45,39a624bb-2f04-44a3-8ae5-3333eba0d256,正しいログインidとパスワードを入力しsms認証も通っているのに、読み込み画面のまま進捗しません
2023-12-10 12:56:45,39a624bb-2f04-44a3-8ae5-3333eba0d256,キャッシュを削除しても同じで、使えません
2023-12-06 11:36:57,6439cb9d-892e-48b3-85ae-294d27b15668,電子レシートの機能がなく不便です
2023-12-11 11:41:09,d5f85d9a-50c2-4ed9-a88c-99821d171491,こんなにお得が多いなんて驚きと感動です
2023-12-14 23:42:46,fea30634-bc80-4839-aac8-54f900647071,関西圏内何処でも店舗があり、使い勝手が良い
2023-12-06 00:01:47,bb3f52b2-a495-45dc-b387-9049b69042a3,ファミペイ開いて通知みたら消えてたのが更新ありしたら右上開いたら表示変わりみても消えない
2023-12-09 16:39:29,c5eaad04-ab00-4a8a-9693-e65b8f5fe68c,買い物する都度ゲームが出来て楽しい
2023-12-10 12:43:37,4fc821ed-61be-49d3-9241-ca0de5c4317f,アップデートしてから、起動してから表示されるまで読み込みがかなり遅くなってる
2023-12-10 12:43:37,4fc821ed-61be-49d3-9241-ca0de5c4317f,前は速かったのに
2023-12-16 10:44:11,116eba7b-d568-4a76-996b-c117182043c6,使える店舗が増えた
2023-12-07 14:23:09,5adbcbeb-2cf8-489a-9a44-a94c2bdbd39c,ファミリーマートをよく使い一手間を惜しまないのであればインストールするべきだと思います
2023-12-18 08:20:51,bbca8776-9cba-4283-9518-4896ee870719,お酒類等、偶に無料のクーポンが配信されるのは良いですね
2023-12-01 13:58:44,3c7dcee1-ad3e-4933-b70c-e359085335e7,料金支払いでもポイントがつくところが魅力です
2023-12-17 09:56:09,6bc51697-2ce0-4b8f-a989-e6a3da73976b,毎日確認するのが楽しい
2023-12-17 08:02:55,b28201fd-ca13-4df1-adf6-4c0c9daac3a2,定員さんが優しくてとても良かったです
2023-12-16 21:05:39,36c9cc2a-1ad4-4725-a383-beedec836417,履歴が出力出来ない、スクショ出来ない最悪
2023-12-13 21:05:00,21559d22-4058-414f-98f2-208b1f8e1f30,起動のたびに30mbくらい持っていかれるようになったのだが
2023-12-13 21:05:00,21559d22-4058-414f-98f2-208b1f8e1f30,マジ勘弁
2023-12-05 23:03:58,48dbd70f-ebd7-41b3-a461-28dc2b159616,稀に無料クーポンが貰えて、とても嬉しいです
2023-12-07 09:33:13,7170755d-76d3-49a2-8a21-fc66fb320f95,使いづらい見づらい店舗検索もできない
2023-12-11 21:55:10,dcf3a24e-999d-4207-bdff-ea56c692aa90,使いやすいとは思います
2023-12-10 02:21:26,0beee19f-ea47-4b06-a378-67021c434335,パンがとても美味しいよ~
2023-12-16 14:51:12,f5e6e4ee-6fcd-4c53-84eb-58c1bdc2fb5e,コンビニ3社の中でファミマが一番、姑息
2023-12-16 14:51:12,f5e6e4ee-6fcd-4c53-84eb-58c1bdc2fb5e,クーポンの期限をあり得ないくらい短く設定したり、アプリで3日以内に受け取らないと失効するとかそんなのばっかり
2023-12-16 14:51:12,f5e6e4ee-6fcd-4c53-84eb-58c1bdc2fb5e,他のコンビニのほうが信頼できる
2023-12-10 19:34:49,01da8fd4-082c-4598-9d1e-59e45dd0ed73,いつもファミマアプリにはお世話になってます
2023-12-10 19:34:49,01da8fd4-082c-4598-9d1e-59e45dd0ed73,使ってみて
2023-12-15 05:13:35,0d51204b-87ab-4e97-8868-f44860aeec17,ファミペイポイント頂きました
2023-12-15 05:13:35,0d51204b-87ab-4e97-8868-f44860aeec17,嬉しいです
2023-12-08 15:21:25,ebb7702b-e0a9-4f99-819e-6c81fc1759f0,登録手続きに予期せぬ時間を要した
2023-12-05 10:08:27,995510a8-e0ec-4aea-a40e-257addfbb3ae,色んな特典があって楽しい
2023-12-11 12:21:12,5c971e3f-85d5-4b55-b15f-3943de82c8a3,暗証番号の再設定に140円だよ050に電話させるサポートって利用者に無駄カネさせることなんだ
2023-12-12 19:36:05,84c23e84-8e5a-4953-88aa-d50d0232f337,美味しい
2023-12-12 19:36:05,84c23e84-8e5a-4953-88aa-d50d0232f337,もっと食べたい
