at,reviewId,content
2023-10-25 23:23:43,7005bcb2-ead9-48ca-beaa-666d23594e1c,レジ前でバーコードを読み取る前におすすめキャンペーンやおすすめ商品に誤って触れてしまい、ブラウザに飛ばされてしまいます
2023-10-25 23:23:43,7005bcb2-ead9-48ca-beaa-666d23594e1c,その結果、レジ前でもたつき時間がかかります
2023-10-25 23:23:43,7005bcb2-ead9-48ca-beaa-666d23594e1c,アップデートでトップページの動作は以前よりは改善されましたが、依然として使いづらいと感じます
2023-10-25 23:23:43,7005bcb2-ead9-48ca-beaa-666d23594e1c,私は割引があるときだけこのアプリを使用しています
2023-10-25 23:23:43,7005bcb2-ead9-48ca-beaa-666d23594e1c,割引がない場合、絶対にこのアプリを使わないでしょう
2023-10-01 16:12:14,fc96d4ce-3165-4585-8104-1df854521191,使いづらくなって残念、回数券とクーポン選択を何故分けてしまったのですか
2023-10-01 16:12:14,fc96d4ce-3165-4585-8104-1df854521191,以前は簡単タップで一度に素早く選択できていたので、駅の混雑レジで非常に便利でした
2023-10-01 16:12:14,fc96d4ce-3165-4585-8104-1df854521191,画面上部で操作できるように改良してほしい
2023-10-01 16:12:14,fc96d4ce-3165-4585-8104-1df854521191,腱鞘炎の親指で画面下部と上部、左右をタップするのは片手では無理、バーコード画面もボタンも小さくなってしまい、もっと年齢高めの人にも使いやすいように考慮してくださいませんか
2023-10-21 09:58:56,ce9b7a2c-8409-4290-bd58-7788f548ce14,2023年10月21日土ポイントカードをtカードから楽天ポイントカードに変更したら、アプリの画面がくるくるマークのままで表示されなくなりました
2023-10-21 09:58:56,ce9b7a2c-8409-4290-bd58-7788f548ce14,アプリを入れ直してもダメ、端末を再起動してもダメ
2023-10-21 09:58:56,ce9b7a2c-8409-4290-bd58-7788f548ce14,開いたままバックグラウンドで他の作業をして、しばらくして開いたら、ポイントカードの認証できずに時間がかかっていたようです
2023-10-21 09:58:56,ce9b7a2c-8409-4290-bd58-7788f548ce14,時間がかかり過ぎだし、認証中という画面にしたりしてくれないと、不具合かと思ってしまいます
2023-10-16 17:25:39,b7d2af37-a70a-4ffb-91d0-04bda74916a3,紐つけたポイントを貯める方はファミペイバーコードの中に組み込まれているので圧倒的に楽
2023-10-16 17:25:39,b7d2af37-a70a-4ffb-91d0-04bda74916a3,時々、先にチャージしてから残高で払う処理を理解してなくて現金払いとして収納してしまう店員さんがいる
2023-10-16 17:25:39,b7d2af37-a70a-4ffb-91d0-04bda74916a3,pop掲示されているボーナスがこれだとつかない
2023-10-16 17:25:39,b7d2af37-a70a-4ffb-91d0-04bda74916a3,ただためたポイントを使う方はファミペイ残高と各ポイント残高の併用は過去に一度だけやってくれた店員さんがいるが、よほどレジ処理が煩雑なのか基本できませんと断れれる方が多い
2023-10-16 17:25:39,b7d2af37-a70a-4ffb-91d0-04bda74916a3,便利だがレジ待ちで時々フリーズするのがめんどい
2023-10-16 17:25:39,b7d2af37-a70a-4ffb-91d0-04bda74916a3,毎回じゃないけど、フリーズしたら要再起動
2023-10-16 17:25:39,b7d2af37-a70a-4ffb-91d0-04bda74916a3,クーポンはさっと済ませたいからいちいち提示ページに潜らないことが多いし、見ても買おうと思ったものに噛み合ってない場合が多くほとんど使ってない
2023-10-16 17:25:39,b7d2af37-a70a-4ffb-91d0-04bda74916a3,色々細かいところが惜しい
2023-10-10 10:38:39,2eec1cac-4976-44ba-bf96-45c086b935b0,今までtカードを機械に入れ込み読み込ませていたが、その機械が読み取りづらく何度となく失敗したことか、、このアプリを使えばバーコードを読み取って貰えれば簡単にポイントも付与されるので、大分楽になりました
2023-10-10 10:38:39,2eec1cac-4976-44ba-bf96-45c086b935b0,お得なクーポンも適時出されるので、損することはないかと思います
2023-10-10 10:38:39,2eec1cac-4976-44ba-bf96-45c086b935b0,無料クーポンも定期的に貰えるので一石二鳥です
2023-10-10 10:38:39,2eec1cac-4976-44ba-bf96-45c086b935b0,某コンビニ大手よりファミマを使用することが多くなりました
2023-10-13 14:15:16,d982be15-96df-4962-88b1-8151ce4ed8e6,■famipayを使うのオンオフボタンがホーム画面からワンクッション動作が増えた✕■戻るボタンでアプリが閉じない仕様になった✕前のバージョンのほうが断然使いやすい
2023-10-13 14:15:16,d982be15-96df-4962-88b1-8151ce4ed8e6,それでも良いアプリだと思います
2023-10-13 14:15:16,d982be15-96df-4962-88b1-8151ce4ed8e6,セブンアプリみたいに商品在庫ができるようになれぱ最高
2023-10-13 14:15:16,d982be15-96df-4962-88b1-8151ce4ed8e6,是非
2023-10-07 10:24:18,e269feee-c9dd-49d7-89fb-e6345fdc996f,立ち上げる際に新規更新ありで更新しないとログイン出来ないが、ファミマの情報収集のために入れてあるだけだから、使えなくても別にいいけど、その程度のアプリと言うことですね
2023-10-07 10:24:18,e269feee-c9dd-49d7-89fb-e6345fdc996f,だいたい、クーポンをセットして30分以内に購入しないと使えなくなるのは不思議
2023-10-07 10:24:18,e269feee-c9dd-49d7-89fb-e6345fdc996f,一々、入店時にセットして急いで商品を選びレジに並んでいる間に30分以上たち、クーポンが消えることがあり意味不明なセット行為と制限時間だよなぁ
2023-10-04 17:35:51,5a1bff6b-3769-4f06-9873-6b1c03e6ce48,キャンペーンでアプリ更新を強いるものがあるが、その流れだと更新できずに先に進まない場合が多い
2023-10-04 17:35:51,5a1bff6b-3769-4f06-9873-6b1c03e6ce48,またエントリーしようとするとグーグルプレイのファミマアプリページに飛ばされ、そこからファミマアプリを起動して、また最初に戻るといった無限ループになって進まない
2023-10-11 17:47:02,87ace7d5-a616-430c-84ad-432f323e912e,大変使いにくいです
2023-10-11 17:47:02,87ace7d5-a616-430c-84ad-432f323e912e,銀行口座からチャージ出来るように設定し、チャージして使った事があるのに、次にチャージする時はまた銀行口座を登録しろと言われ、免許証の写真も何度も何度も何度も何度もエラーが出ます
2023-10-11 17:47:02,87ace7d5-a616-430c-84ad-432f323e912e,他のバーコード決済アプリでこんな事は一度も無いです
2023-10-11 17:47:02,87ace7d5-a616-430c-84ad-432f323e912e,普通は一度登録したら、その口座からチャージ出来るものじゃないですか
2023-10-11 17:47:02,87ace7d5-a616-430c-84ad-432f323e912e,コンビニでちょっと買い物するのに物凄く手間と時間がかかり、あり得ない仕組みだと思います
2023-10-06 00:46:35,63bbc517-32fa-422a-a9cc-513c83cd641d,10日・25日のチャージに特典があるのは結構だが、忘れた頃に特典クーポンを配信し、そこからまた更に数日経過すると新たなクーポンに紛れて行方不明になる糞仕様
2023-10-06 00:46:35,63bbc517-32fa-422a-a9cc-513c83cd641d,穿った見方だが、特典クーポンを使わないまま期限切れにさせたいのか
2023-10-06 00:46:35,63bbc517-32fa-422a-a9cc-513c83cd641d,と思ってしまう
2023-10-06 00:46:35,63bbc517-32fa-422a-a9cc-513c83cd641d,7-11アプリのように無料引換と割引で分類可能にするか、不要なクーポンを削除可能にして頂きたい
2023-10-06 00:46:35,63bbc517-32fa-422a-a9cc-513c83cd641d,上記の文章を書いてから数ヶ月経過したが、一向に改善される事はありませんね
2023-10-06 00:46:35,63bbc517-32fa-422a-a9cc-513c83cd641d,最低評価とさせていただきます
2023-10-06 00:46:35,63bbc517-32fa-422a-a9cc-513c83cd641d,追記
2023-10-06 00:46:35,63bbc517-32fa-422a-a9cc-513c83cd641d,ui刷新である程度改善されたので、最低評価を取り消します
2023-10-10 09:59:50,d0570497-0474-4b44-8c1e-fe918137dc70,レシートに印字されている割引クーポンのqrコードを読み込む時かなりの確率で失敗になる
2023-10-10 09:59:50,d0570497-0474-4b44-8c1e-fe918137dc70,失敗すると2度とそのクーポンは受け取れなくなる
2023-10-10 09:59:50,d0570497-0474-4b44-8c1e-fe918137dc70,レシートに付いてきたりアプリに届いたりして面倒だからアプリに届くクーポンに統一すれば良い
2023-10-10 09:59:50,d0570497-0474-4b44-8c1e-fe918137dc70,アプリの無料クーポンが届いたとのお知らせがあり見てみたら割引クーポンだったけどどういう事
2023-10-23 10:31:20,d1ca7d21-2811-4c2d-b95e-01cb72579dca,アップデート後、戻るでアプリが終了できなくなり地味に困っています
2023-10-23 10:31:20,d1ca7d21-2811-4c2d-b95e-01cb72579dca,私の環境だけでしょうか
2023-10-23 10:31:20,d1ca7d21-2811-4c2d-b95e-01cb72579dca,その他は概ね良好です
2023-10-23 10:31:20,d1ca7d21-2811-4c2d-b95e-01cb72579dca,追伸:その後のアップデートで以前のように終了できるようになりました
2023-10-23 10:31:20,d1ca7d21-2811-4c2d-b95e-01cb72579dca,ありがとうございます
2023-10-04 21:22:52,8d995a97-ccc2-4298-a8e5-6c223238a3c2,いつも利用させてもらってます
2023-10-04 21:22:52,8d995a97-ccc2-4298-a8e5-6c223238a3c2,色々と無料クーポンや、割引クーポンがあって嬉しいです
2023-10-04 21:22:52,8d995a97-ccc2-4298-a8e5-6c223238a3c2,特に賞味期限が近くなった商品よ割引は廃棄の無駄が減る素晴らしいアイデアだと思います
2023-10-04 21:22:52,8d995a97-ccc2-4298-a8e5-6c223238a3c2,私は、すぐ食べる時は賞味期限が近い割引を買うので、お店も古い商品から売れて廃棄が無くなり、消費者も安く買えて納得です
2023-10-25 00:01:07,aa7e06a7-2a35-4d2c-98ad-e07c576c84de,アブリを利用させて頂いています
2023-10-25 00:01:07,aa7e06a7-2a35-4d2c-98ad-e07c576c84de,買い物をしてもポイントが付与されません
2023-10-25 00:01:07,aa7e06a7-2a35-4d2c-98ad-e07c576c84de,付与されるのはゲーム
2023-10-25 00:01:07,aa7e06a7-2a35-4d2c-98ad-e07c576c84de,でのポイントのみ
2023-10-25 00:01:07,aa7e06a7-2a35-4d2c-98ad-e07c576c84de,なので全然ポイントが増えません
2023-10-25 00:01:07,aa7e06a7-2a35-4d2c-98ad-e07c576c84de,連携側はきちんと付与されていますが
2023-10-25 00:01:07,aa7e06a7-2a35-4d2c-98ad-e07c576c84de,2倍どころか
2023-10-25 00:01:07,aa7e06a7-2a35-4d2c-98ad-e07c576c84de,です
2023-10-25 00:01:07,aa7e06a7-2a35-4d2c-98ad-e07c576c84de,何か原因があるのでしょうか
2023-10-22 22:33:26,76d13c75-2725-4928-8078-ce264c04536f,大したアップデートしてないんだから、アプデしないと使えない仕様に変更したのは非常に不便で迷惑
2023-10-22 22:33:26,76d13c75-2725-4928-8078-ce264c04536f,あと新しいアプリが公開されていますと表示が勝手にしゃしゃり出て、アプデしないとその表示消せない仕様も非常に迷惑
2023-10-22 22:33:26,76d13c75-2725-4928-8078-ce264c04536f,他社のコンビニのアプリは、更新しなくても使えますし、こんな図々しい表示はしません
2023-10-22 22:33:26,76d13c75-2725-4928-8078-ce264c04536f,このアプリ製作者はホントにセンス無い
2023-10-22 22:33:26,76d13c75-2725-4928-8078-ce264c04536f,レジ前でいきなりアプデしないとアプリ使えないと表示され慌ててアプデすると、アプデ後は勝手にログアウトされててパスワード入れろ→snsコード入れろ→更にファミペイ払いにしようとするとこれも勝手にログアウトされてて、更にパスワード入れろ→snsコード入れろ→ようやく使える
2023-10-22 22:33:26,76d13c75-2725-4928-8078-ce264c04536f,これをレジ前でするんですよ
2023-10-22 22:33:26,76d13c75-2725-4928-8078-ce264c04536f,毎回毎回
2023-10-22 22:33:26,76d13c75-2725-4928-8078-ce264c04536f,ファミペイを使おうとするとネチネチ嫌がらせって、ファミペイ使うなってこと
2023-10-22 22:33:26,76d13c75-2725-4928-8078-ce264c04536f,あと、vpn使用下だと使えない点も非常に不便
2023-10-22 22:33:26,76d13c75-2725-4928-8078-ce264c04536f,それと金額だけじゃなく、きちんと何を買ったのかレシートみたく、明細を表示して下さい
2023-10-22 22:33:26,76d13c75-2725-4928-8078-ce264c04536f,案の定、調べたら割引忘れされていた
2023-10-29 21:47:00,3c33f180-5982-466e-a72b-b320e0aff31b,クーポンは使える商品が決められていて、パスタだったらパスタ全品に使えるとか麺類ならどれでも使えるとかだったら使いやすいです
2023-10-29 21:47:00,3c33f180-5982-466e-a72b-b320e0aff31b,そこだけが残念なところです
2023-10-10 07:16:37,f2a97cc2-4c8d-4318-95c3-84deff4fc134,今時のアプリで更新ありの時にバーコードが使えないとか、なかなか時代錯誤なアプリ
2023-10-10 07:16:37,f2a97cc2-4c8d-4318-95c3-84deff4fc134,クーポンも微妙で、もともと使うメリットが少ないアプリだから、これぐらいは改善して欲しい
2023-10-10 07:16:37,f2a97cc2-4c8d-4318-95c3-84deff4fc134,可でもなく不可でもないアプリ、上記の理由で-1としました
2023-10-06 19:02:34,2bdf1ec6-f4a1-4882-ad93-ed7354a46baf,以前の画面に慣れてる、特に年配の方がパニックになっている
2023-10-06 19:02:34,2bdf1ec6-f4a1-4882-ad93-ed7354a46baf,開発している方々は見ればわかるたろの感覚だと思うが、とにかく使いづらい
2023-10-06 19:02:34,2bdf1ec6-f4a1-4882-ad93-ed7354a46baf,前のままでよかったのに
2023-10-06 19:02:34,2bdf1ec6-f4a1-4882-ad93-ed7354a46baf,何1つ良くなった点が無い
2023-10-06 19:02:34,2bdf1ec6-f4a1-4882-ad93-ed7354a46baf,困惑する人達でレジが混んで大迷惑
2023-10-04 09:55:31,e58a58d8-00df-49d8-85e4-a2f3bcf19d84,回数券とクーポンを別タブに分けたのを知らずに使い切ったと思い、回数券を買ってしまいました
2023-10-04 09:55:31,e58a58d8-00df-49d8-85e4-a2f3bcf19d84,回数券の使用は今まで1タップだったのに、2タップして更にホームに自力で戻らなければならなくなったので、本当に不便になってしまいました
2023-10-08 10:18:19,097767de-6f45-4fe9-9411-74a7b5321229,タブレットで使用しているが、アプリを更新したらバーコードの表示が大きくなりスキャンできなくなってしまった
2023-10-08 10:18:19,097767de-6f45-4fe9-9411-74a7b5321229,縮小表示機能をつけてもらいたいです
2023-10-13 14:29:19,faf37506-2eba-4e91-adb0-84731ab96f3d,クーポン数は他と比べて少ない感じだがわかりやすくていい:クーポンドレッシング通知だと一本無料になってるけどクーポンは100円引きにってるけど通知が違うんだろうね一本400円以上するからね無料じゃないな:ファミペイのいいところは2個ある一つはファミマで使えること笑それはいいとしても一つは通知音が独自でファミペイの通知ってすぐわかるとこかなあとほかのペイに比べて機能が少ない分軽い感じ以前は出来ていた楽天ポイントの連携が出来なくなった楽天にはログインはしているらしいログインのメールが来る
2023-10-13 12:35:10,304b366a-b309-46f6-bf03-5f35bc02c40f,使いづらくなりました
2023-10-13 12:35:10,304b366a-b309-46f6-bf03-5f35bc02c40f,この間、メッセージの送信ミスで100円引きを無料クーポンと書いて届きました
2023-10-13 12:35:10,304b366a-b309-46f6-bf03-5f35bc02c40f,それは構わないのですが、問い合わせで返信不要を選択したのにも関わらず、返事が来て、小馬鹿にした内容だったので少し腹が立ちました
2023-10-02 08:03:50,e26f6326-5b48-4168-a4b0-e6d5cd3abf3c,先日のアップデートで画面レイアウトなどが変わり、非常に使いづらくなった
2023-10-02 08:03:50,e26f6326-5b48-4168-a4b0-e6d5cd3abf3c,もとに戻して欲しい
2023-10-02 08:03:50,e26f6326-5b48-4168-a4b0-e6d5cd3abf3c,特に回数券がぱっと出せないのが非常に不便
2023-10-29 18:17:29,46efe417-fb5e-439a-a41d-9950bca10a98,期限切れのクーポンがよく表示されます
2023-10-29 18:17:29,46efe417-fb5e-439a-a41d-9950bca10a98,一見利用可能ですが期限内のクーポン同様の表示です、レシート見て値引き反映されておらず、その度にクレーム入れたくなります
2023-10-16 09:11:28,5b852bda-9dc2-40f3-b569-95f730821ba9,起動が遅いです
2023-10-16 09:11:28,5b852bda-9dc2-40f3-b569-95f730821ba9,一番の利点が会計がパッと済むことなのに、アプリ開いてからスプラッシュ画面も合わせて5-10秒の待ち時間
2023-10-16 09:11:28,5b852bda-9dc2-40f3-b569-95f730821ba9,バーコードだけ先に出してほしいです
2023-10-29 11:12:01,9cf21b6b-0ac1-4f51-b502-cdb6cd540d7a,とても使いづらくダウングレード
2023-10-29 11:12:01,9cf21b6b-0ac1-4f51-b502-cdb6cd540d7a,送り先が確定していなくても間違って贈るボタンを押してしまうと回数券が消えてしまう欠陥アプリ
2023-10-24 12:56:36,be097987-20ee-41f4-8012-6e3d5d39994a,クーポンもまとめて使えてチャージしたら支払いも出来てコンビニアプリの中でいちばん優秀だと思う
2023-10-24 12:56:36,be097987-20ee-41f4-8012-6e3d5d39994a,たまに無料券も貰えて使わないクーポンは友達に送ったりできるのもいいですね
2023-10-26 01:42:48,35394bf6-b597-4983-88d1-bef733576c35,アプデの度に使いにくくなるし、端末変えてログインしようとしたらシステムエラーコード199って何回やりなおしても開けない
2023-10-26 01:42:48,35394bf6-b597-4983-88d1-bef733576c35,こういうとこでも最弱か〜ᴖᢦᴖ
2023-10-26 18:08:08,987a1e1e-52a4-464c-9c12-ee90fe29ab5a,急にバーコード表示のサイズが大きくなり、タブレットで使用できなくなりました
2023-10-26 18:08:08,987a1e1e-52a4-464c-9c12-ee90fe29ab5a,残高も使用できず大変困っています
2023-10-12 18:28:31,765c235e-baa1-4bfe-9481-892d509ecde1,最初は予定注文で利用していたが今やキャッシュレスとして使っています
2023-10-12 18:28:31,765c235e-baa1-4bfe-9481-892d509ecde1,イザ財布の残高が足りない時に使えます
2023-10-12 18:28:31,765c235e-baa1-4bfe-9481-892d509ecde1,まだポイントは体験していないけどね
2023-10-09 00:25:05,a994c51d-e527-4f6b-bdf6-0024bbf56b98,使用後の操作が煩わしく、使い勝手が悪くなった印象
2023-10-09 00:25:05,a994c51d-e527-4f6b-bdf6-0024bbf56b98,以前のように端末の戻るでアプリが終了するように戻してほしい
2023-10-12 09:56:35,4d412756-ea1f-4547-b511-fb655b233389,ポップアップが非常に邪魔です
2023-10-12 09:56:35,4d412756-ea1f-4547-b511-fb655b233389,通知なら放置できるがポップアップは無視できないため作業が滞りそのたびイライラするのでどうみても逆効果
2023-10-10 11:28:20,277694a1-9b15-49b1-a76c-43d26873b031,配布のお知らせが無料クーポンとなっているのにただの100円引きクーポンでした
2023-10-10 11:28:20,277694a1-9b15-49b1-a76c-43d26873b031,普段からアプリをしっかり使わせていただいている分非常に残念に思いました
2023-10-07 21:28:25,c1acc0bb-298f-4484-b5bb-9cdde456592d,バーキコードが大きくなったので店でコードを認識しなくなり使えなくなった
2023-10-07 21:28:25,c1acc0bb-298f-4484-b5bb-9cdde456592d,改悪前は、普通につかえてた
2023-10-07 21:28:25,c1acc0bb-298f-4484-b5bb-9cdde456592d,セッティングをもとどおりにしてくれませんか
2023-10-14 10:45:39,4c0614c0-cac4-46e3-9cd1-23d8c6235304,不正アクセス防止が、色々面倒ですが、安心のためには仕方がない無いと思っています
2023-10-14 10:45:39,4c0614c0-cac4-46e3-9cd1-23d8c6235304,ただ、ログアウトと退会が並んで有るので、離して貰える有りがたいです
2023-10-10 09:51:12,cbf8802c-4945-4b48-995c-b7c3f13b58b0,アプリ不具合多し
2023-10-10 09:51:12,cbf8802c-4945-4b48-995c-b7c3f13b58b0,アプリの通知で無料クーポン付与のメッセージが届き、アプリを開いたが無料クーポンは無い
2023-10-10 09:51:12,cbf8802c-4945-4b48-995c-b7c3f13b58b0,なんで
2023-10-10 09:51:12,cbf8802c-4945-4b48-995c-b7c3f13b58b0,リンクに飛べない等の不具合もよくある
2023-10-04 11:43:31,2f142d84-1035-4751-b091-08ec8dcbf6ff,毎朝、利用してます
2023-10-04 11:43:31,2f142d84-1035-4751-b091-08ec8dcbf6ff,スタッフがてきぱきしていて待たされず快適に出勤出来ます
2023-10-04 11:43:31,2f142d84-1035-4751-b091-08ec8dcbf6ff,ただ、品切れの時、特に雑貨が少し長いかなぁ
2023-10-19 00:00:43,64a47721-efe0-4fb2-8194-344007887b2f,最新バージョンにしたら、戻るボタンで終了できなくなり、アプリが閉じられない
2023-10-08 12:23:54,e3ce4a92-fd79-4f55-87de-c4f5db1eeae1,タブレットで使用すると、バーコードが大きすぎて読み込めないので使用不可
2023-10-08 12:23:54,e3ce4a92-fd79-4f55-87de-c4f5db1eeae1,何を考えてアプリを作っているんだろう
2023-10-15 06:57:42,eef07008-ec86-43aa-89cc-59dfc9b45950,familymartをよく利用する方はファミペイ支払いが便利
2023-10-15 06:57:42,eef07008-ec86-43aa-89cc-59dfc9b45950,頻繁にお得なクーポンも届くので少なくても週7回は利用しています
2023-10-10 13:24:02,4c3da2b0-6ffd-40e5-bffb-418e0a6df7e0,無料クーポンが来るけど、たまに表示されない時と100円引きとかのクーポンが出る
2023-10-10 13:24:02,4c3da2b0-6ffd-40e5-bffb-418e0a6df7e0,無料と表記されても、○○円引きになっているとがっかりする
2023-10-07 16:59:40,08538b86-6306-4128-8e0c-fe3adc4553c4,アプリをインストールしましたが、ずっとグルグルしていて全く使えないのは何故
2023-10-07 16:59:40,08538b86-6306-4128-8e0c-fe3adc4553c4,使いにくくてアンインストールしました
2023-10-07 16:59:40,08538b86-6306-4128-8e0c-fe3adc4553c4,これでスッキリ☆彡
2023-10-27 08:42:48,0b04f44c-0e61-452f-88f7-0ccf92bf22ec,ログインしたあと、永遠とロード画面
2023-10-27 08:42:48,0b04f44c-0e61-452f-88f7-0ccf92bf22ec,でも、通知は送ってくる
2023-10-27 21:56:53,fb642643-fc3d-422c-b44d-8d5e131ada2d,uiが変更になってホームに戻りにくいしなぜわざわざこの並びにしたのかわからない無料クーポンにかなりのばらつき
2023-10-23 01:24:28,b57b0af3-e223-45a9-8b38-896d92fe9830,店頭にて、アプリを更新しないと使えず、いざ更新
2023-10-23 01:24:28,b57b0af3-e223-45a9-8b38-896d92fe9830,だが、45分経っても更新が終わらず何も買えずにファミマをあとに
2023-10-23 01:24:28,b57b0af3-e223-45a9-8b38-896d92fe9830,二度とファミマで買い物はしないから、アプリに入っているお金を返せ
2023-10-23 01:24:28,b57b0af3-e223-45a9-8b38-896d92fe9830,本当は星0
2023-10-23 01:24:28,b57b0af3-e223-45a9-8b38-896d92fe9830,新しい取り込み詐欺
2023-10-13 22:21:12,b3d669bc-b75b-48d8-a748-6a8d8e8851a5,回数券が使いにくいですね6アクションしないとレジへ行けない毎日使う回数券なのに残念最短で使えるように改善願います
2023-10-31 14:37:40,a3ab205e-f49c-47ef-a21a-53254025cbe1,自分の持ち金に合わせてチャージ出来、使いすぎずポイントも貯まるのでお得な気持ちです
2023-10-04 03:19:13,350226ae-19b1-42c7-acb4-609af5eb3a5a,アップデートしたら左下ボタンだと戻らなくなり凄い使いづらく前のやつに速急に戻してくださいそして新機能全くもって見にくい前のバージョンのバーコードとか大きく表示に戻してください
2023-10-03 18:05:27,fbb9eac0-fd70-49b1-ad76-39ef5cfa0b2b,ポイントやクーポンなど、おトクで使いやすいので有り難いです
2023-10-10 11:21:52,9c187c4a-8195-43bc-9b61-16238f4416bd,お得な無料クーポンお届けってメッセージあり開いたら無料でなく100円引きだった、無料だろうが100円引きだろうがどうでもいいが、違うの開いたかとか気になり探した時間がもったなかった
2023-10-25 15:01:49,672fffd0-02c0-41ff-a20c-7e73b74b3d76,電気代など公共料金を店頭に赴くことなく支払いができるので重宝してます
2023-10-27 11:04:46,95969b8a-3b56-49b8-8228-0c810a65b0ed,メッセージ一覧で一括既読機能を追加してほしいです
2023-10-05 07:21:36,e401a544-507f-400c-9a90-b99b69f058d9,最近、戻るボタンを押しても閉じられないのですが
