reviewId,userName,userImage,content,score,thumbsUpCount,reviewCreatedVersion,at,replyContent,repliedAt
gp:AOqpTOHtH8N2USYVxgljw7I1p6AQnk3dj9yo9nwukoB5Q9xbW6Py0QqAZUwawDqL0uLPA5wk_wc4COMYlNQK9g,高野真,https://play-lh.googleusercontent.com/a/AATXAJwmzEeQpG1r5_R4_Rsbw9_pjtyTd2FD7kzTOD9m=mo,アプリが開かない,1,1,1.23.0,2021-11-29 12:40:06,,
gp:AOqpTOHyDRwZbeJa49HvlC8YDBpdLcwlYz4HPZttCfHpXzj6GXvAW6qt7rbB1dDQ19Whi1je1ltuqjTU0HCYPQ,R,https://play-lh.googleusercontent.com/a-/AOh14Ggil_um_L4vSGX1zkR3Vf27hQnOGd4PjMFn1ZLH,え、強制終了で一切開かなくなったんやけど。。 レジ前で大恥かいたわ！チャージした残り返せよ！,1,2,1.23.0,2021-11-29 12:29:09,,
gp:AOqpTOHfcF1weKRBfRkld8BNLptZinIPlnELHkcDlL8jq6rintJNM-1p1PfSUZlEsgbInXkfG7YaR_jnYjjdtQ,日比野敏章,https://play-lh.googleusercontent.com/a/AATXAJxmjOHtYfB5270c5Z9z7uAs_HcrhR7_oJn_FJkf=mo,レジで並んだ後に精算出来ずに全て棚に戻しました。店内入口とか放送で障害の告知を！,1,2,1.23.0,2021-11-29 12:18:55,,
gp:AOqpTOHcdINOxUxBbuRdtbbAlnnJZGZ-WWcDf-QSFpnnFjmmagbs61ygvWAIpuQDBI0fo7OiJpaeas-9XNapnQ,いいじまりょう,https://play-lh.googleusercontent.com/a/AATXAJxI0W90Ht0g6_VgpOiWsdg6zZncrv8VWgbRPW9F=mo,システム改善後アンドロイドで開かない。,1,3,1.23.0,2021-11-29 11:58:39,,
gp:AOqpTOFcVo5SA81wvoKUd8zU9pNL4l15wEnu4M1yRPHyTjzx7lI9ySeexw0-G5MzGP9IPaxkogFPE7EQMqqiGw,94 nowest,https://play-lh.googleusercontent.com/a/AATXAJw9QaeguYHzyAmP06wjKnhpMdxN1epTmoYFdRxt=mo,何度開いてもエラーで使えない。クーポンや情報見たいのに困る,1,1,1.23.0,2021-11-29 11:56:27,,
gp:AOqpTOFmj_Fb-XGA7jAUrQv7GK96_4VyyLaOWB9zb3kHaSnuJYBYbr0wLEs575eNxckn5dPHiJ1hY8yGqk964g,ミサト,https://play-lh.googleusercontent.com/a-/AOh14Gj6qqP_tazuixN51DlCXx_lGGqSm_uMwIBR95770g,11月28日から急に使えなくなりました。Androidです。 こんな時のために会員カードのバーコードをスクショしておいたので、なんとかチャージ分を使うことはできました。しかし、残りのポイント数などは買い物をしなければ確認することが出来ないので大変困ります。早急に直してください。,1,3,1.23.0,2021-11-29 11:49:40,,
gp:AOqpTOGtE4vDg-6En7oT1h5_7Dx22xKX3SrYVz_FfSNNQDaIDMx0Z9gOW-X2WrhSC8lCVLStNhwYUZb2a4b2GA,高橋千鶴,https://play-lh.googleusercontent.com/a/AATXAJxpij8WxdUWsLW-vOQC2eB1INAoKGH92_ZmPkwj=mo,ゴミ,1,1,1.23.0,2021-11-29 11:43:10,,
gp:AOqpTOFWB6ye6aBJoiwolOAVgz0IOuv7vdfcsT42mPtNj_M8iSatspuAT54hW560VgWV8_yWssFmU2WsMBa-kg,disk .m,https://play-lh.googleusercontent.com/a/AATXAJxZHMBA8aAR1SXHOD2KB3SsHa3prgxfPgc2lsfr=mo,2日前からアプリが開けません。 レジの人に相談したら「機内モードにしたら開けますよ」と伺いました。 とりあえず開けるようになるまではポイントカードとして使用します。,1,2,1.23.0,2021-11-29 11:32:51,,
gp:AOqpTOHMr14GNpwWYoC4FYgM5imxzUd7Hwgwqw9YM0Ap_Law-nT6cZyo6iuLoK0obhbvpXhJOR3iqU1qyeSEMQ,えな,https://play-lh.googleusercontent.com/a-/AOh14Gh2RTSLXeLFFhUpNcrwdCBg7fHhU_Qekn9Z3YK2,アプリが開けません,1,1,1.23.0,2021-11-29 11:26:14,,
gp:AOqpTOFhi3Xwl11-mbGOFiDwJKt0owHQuS-ewZA2SVI7E8iXEzkzYEaxL2z60W74J_rDPsN1_EJEq1alesMXLg,チョコパイ三角,https://play-lh.googleusercontent.com/a-/AOh14GivFVWBwXYPOxfiBKIr14JZF4obViSQEspVYhsq1g,全然接続できない！！,1,1,1.23.0,2021-11-29 11:01:19,,
gp:AOqpTOFCjCWRllImBDy0A43Bo9kJiPiB2hmrxZd6UfXfp4-2LKhMP189EMQ-fjXnEOeClstInHNpxxa3C7zp8Q,祐子,https://play-lh.googleusercontent.com/a/AATXAJy2kdnacpEjzQ9t0x1__yPP2j9K5fWMSmZSQgOb=mo,一昨日から何度立ち上げても動きません。クーポン見てから来店して買い物するのが日課なんですが、どうなってますか？,1,1,1.23.0,2021-11-29 10:57:33,,
gp:AOqpTOHLWsaBS1o70crgkCPYcdtVtYpAZz1ff_3sGRBRgcux5R5ZYhgX0pST84Z3oVT_TXlw7HxRlEbDXZXRUg,MoreTHan ZiN,https://play-lh.googleusercontent.com/a-/AOh14GicWxtzqklctqL3-K4AXy-SNaCRVSDcEI8zGAc9Hg,先週使えてたのに今日立ち上がらなくなった。Androidですが早くなんとかして欲しい,3,0,1.23.0,2021-11-29 10:52:02,,
gp:AOqpTOGvinENRewtc21pI0HEwZmykI6CgW2oMbMzUAfb0wQo4ohydRrWjJepkA7S048ziRlT3_aPdYrAV-DoiA,そら,https://play-lh.googleusercontent.com/a/AATXAJxJEFxy-jm_N2JtGTvtHHzowCMJG4i4iXthm6yv=mo,ずっとアプリが立ち上がりませんでした。 majicaカードがあるので、思いきってアプリをアンインストールして、再インストールしたら、立ち上がりました。 ただ、再インストール後、カード番号等をもう一度入力するので、カード番号とPIN番号がわからないと、駄目です。 残高も大丈夫みたいです。,1,6,1.23.0,2021-11-29 10:19:20,,
gp:AOqpTOENJzJpyNh5dsnyGwqPNuEucwLEDdsC48ndCCyukW2LQmnKC6m0zGAAnoSR3hKvMVMud9b1F6_AjbO0Tg,高柳ますみ,https://play-lh.googleusercontent.com/a/AATXAJzl_QgxBYCJGFoA9HUGnji36jmSyccuz7Tk7kCK=mo,昨日店で開かなくて帰って来ました。いつになったら使えるようになるのでしょうか?,1,1,1.23.0,2021-11-29 09:58:30,,
gp:AOqpTOFjIQ43q6Iyar4g0UO8HhBJtdtcpSzgUB8J2o-3cNyghaCkc_MMd9OZSYI5zOXRN2r7uptXVK0E-Sexvw,なーみー,https://play-lh.googleusercontent.com/a/AATXAJybV5nODZ2I9aMLT9jgbgSRuuiEhDZe4-LHUjoS=mo,今までは何も問題なく使えていたのに、週末から急に使えなくなった。アプリを開けないから使えない。困ってます。,2,1,1.23.0,2021-11-29 09:52:33,,
gp:AOqpTOHOwrdOPi32vmtz9_llYhwthcq8JYyppaPweHHM6kOVHsqVkQIi0oeOjdJmP6Hia5fCLIxROeRJS6JTJg,isamu tanaka,https://play-lh.googleusercontent.com/a/AATXAJxc3gChTYh4tUiZ-tkYJWyCV9gjxAT4-CCyn5w5=mo,同じくAndroid端末 現在使用できず,1,1,1.23.0,2021-11-29 08:55:30,,
gp:AOqpTOE95hBgQ-uaBwkqblChd-PfjDm05l0NVznUk-Ni-zbgdr0gx_1Tf97VVSEK7K_BCzpGyE2tk4OcZx9Chw,Nonna Saitou,https://play-lh.googleusercontent.com/a-/AOh14GhSgJzIuHfAEFK_vKmS8xMtnUAzMK8Y6lomrbBlJA,2021年11月28日、本日29日と、 アプリを開くと自動で落ちます。 ドンキー内に職場があるので、いつもお弁当などご利用させていただいてます。 が、 こちらは、自業自得ですが、 基本現金を持ち歩いてなく、 アプリ内に入金したお金で、 毎回ドンキーさん、でご飯食べてます、 昨日28日は、仕事が、朝からフルでしたので、昼ご飯と、夜ご飯共に食べなず仕事でしたのでかなり大変でした。 よろしければ、本日中には、 改善していただきたいと願います。,1,3,1.23.0,2021-11-29 08:54:12,,
gp:AOqpTOE4Go9S3KJWpy7r9oGIUUZoH1Xiz3emtR2tRAUh83d2ZNgZSkBmwx28JOJwromUPwmqLTlb5PhYfX4xPQ,H Shimoda,https://play-lh.googleusercontent.com/a/AATXAJwDR6ZO0kYEVSLDRm4Tk46Dp6i9YGKHmi1lnfgX=mo,急にアプリが開かなくなりました,1,2,1.23.0,2021-11-29 08:52:56,,
gp:AOqpTOERn8QIVgVyq7sgs1rSwkQHGEnm2CvZOXvu2agNpi57Krq_dgDTmxeIl4IthsvWiZbuI1oCsosJ3QPZ0g,うえさん,https://play-lh.googleusercontent.com/a/AATXAJx-Yl8mLfOu5TtykjN4OClsM4REd56MzyrPdvn3=mo,起動してもすぐに消えるとなる現象がここ何日間つづいている。 アイフォンはオッケーぽいけどAndroidだけ？　　現金もって行かなかったので、買物諦めました,1,1,1.23.0,2021-11-29 08:40:19,,
gp:AOqpTOFw2xWn8HvznY3dmli2z6QHdSlezh5lmDosn7_thtzvxoiVaLvSvXuPiIGxKU8oumcFtzwAdF1l1lNabQ,s s.,https://play-lh.googleusercontent.com/a/AATXAJxVehmDBs4Xpkb-LjsO6FOUHKy1qbsSFsdk-3vU=mo,皆さんと同じで、25日から未だ(29日)に使えません。 アプリを開くと落ちます。 店員さんに言われ、機内モードにして会員バーコードを開こうとしても、再試行画面が出てそれも開きません。店員さんも把握してなかった様です。 開く人は開いてると言っていましたが、アプデしていない人やiPhoneの方なのかなぁ…。 何にしろ、電子マネーアプリで4日も何かしらアナウンスが無く対応が無いのは不安すぎます。 カード使うと、サンキューメール等は来るけど開けません。,1,7,1.23.0,2021-11-29 08:02:29,,
gp:AOqpTOEOEoVVcbfQj5Au9D9bSFSb5-e_7QLT-yoZlA1jOHxMXgEK6yG2JU6f04OPYbLOJ8RTViH1QIvbVoUDjA,yuki ishihara,https://play-lh.googleusercontent.com/a/AATXAJxz8_AJ6BXn6Se7L6nbrfiSb3WTk-T_KylsSyWd=mo,ここ数日私もやはり立ち上がらない。クーポンは店頭で臨時対応してくれたけど‥早く改善して欲しい。,4,0,1.23.0,2021-11-29 07:29:51,,
gp:AOqpTOFSIVT1tqHUjiIFMAjEUDuF35gwaOlY7B-JKZsbOCGn3mjNkCFfgNi1i0ldJ6EVBskALFbbC5jHrz4_Ag,國井奈苗,https://play-lh.googleusercontent.com/a-/AOh14Gh_HQ-tzddCyxhrrW2uFZCaBc2yxaaS_u_ZHUvkuQ,いつアプリが使えるのか？ず－っと落ちまくり！,1,1,1.23.0,2021-11-29 07:15:30,,
gp:AOqpTOEfStVIyqEO00RNgfzzAF2qX6EOK9vkGnDPaCcQAWb-p4ltkYiFvG7LeGWGhlzh4iELNq-am3_2NY_MIA,サキキヨ,https://play-lh.googleusercontent.com/a/AATXAJygxAazI4fXer0GpUJvCjfQQy7oRoUm8aYZLkZC=mo,アプリが立ち上がらない カードも持っていたから大丈夫だったけど 何度起動しても起動出来ない,2,1,1.23.0,2021-11-29 07:08:18,,
gp:AOqpTOEYxzYhAmHbSXBxrHzSlMEZ_CkBH-FFVWLCXng0Hf2OVCaFqrgY_zHT_wsfFayryUsm4dhcM9iqxVRzvA,菊谷栄司,https://play-lh.googleusercontent.com/a/AATXAJyaEyMGY_H9DSu_aHBe4eLRIfXhPE5oAKwN0wrM=mo,アクセス出来ない,1,1,1.23.0,2021-11-29 07:06:29,,
gp:AOqpTOEsGWBO_Q6DkYyqhiVBa3Zw1LqU9BqpEHPCeRk_i4XQJBj4s2Gnmd7jzfgkfaER_iJrLgLjB1fX_lykgg,日比孝美,https://play-lh.googleusercontent.com/a/AATXAJw2-UKv7VfcNQ3tzommybGSe2a8VMjdA0U_JSHS=mo,アプリが使えません,1,1,1.23.0,2021-11-29 06:56:58,,
gp:AOqpTOHlD0QWKLTwZ34PHGPx3pZWpxBVqZXQyhhoPiaS5cvwzM8pJ7tJuDXqFTXSRc-LlCTOun3UTx9XYz-TBg,田中百合子,https://play-lh.googleusercontent.com/a/AATXAJzejTymAmizLWblLDmbcv04Rq25N4DIayFRl3yU=mo,開けない！繰り返し閉じてしまう。困ってます。,1,1,1.23.0,2021-11-29 06:27:00,,
gp:AOqpTOHA0sxCIYzKglzCFEdbTcdZiloviZlypj5CMGCFxvqv3cKA1dmeORHmSpqXch0ICcbmD8SL0rXhaYBmFg,ミスターまゆげ,https://play-lh.googleusercontent.com/a/AATXAJw31DdiRRKWHYE8u7fVhwGIF1xoNlN2rJ3wRmve=mo,Androidですが、どうやら他の人と同様のエラーが出てる模様。 起ち上げても即落ちる。 クーポン見ようと思って起ち上げたのにこれでは意味がない。クレカがあるからポイントもつくし、買い物は出来るけど、クーポンやサイトが見られない。このままではちょっと使えないな。 随分前にも似たようなことあったけど、そのときはどうやって直ったのか知らないが、同じことではないのかな？ 前回の経験は生かされないのかねぇ？,2,11,1.23.0,2021-11-29 02:36:28,,
gp:AOqpTOEFyPVTrevfKPasaSmil4Pc6BoFUrhUjXyNQt2jsWlvwL1aW5ouRsUqQip9llbpNCXAevcg_ARVtjr61A,Satoshi Ozaki,https://play-lh.googleusercontent.com/a/AATXAJzUI4bbZFkoyQj5FsCbN2T3Wuf7egJ7TWjD0yXe=mo,11/26から全く立ち上がらなくなった。 機内モードにすることで会員バーコードは表示できるのでチャージや支払いは出来るが、クーポンを取得したりできないので不便。早く復旧してほしい。,1,2,1.23.0,2021-11-29 02:30:14,,
gp:AOqpTOFkaU8wyZ5FnHXre3q0On3ScwB3tSM5jsUCjlmUtwPKcDTa7qj0I9h2kUED3GJ9-9mcpzYnq09MCsQzDQ,m m,https://play-lh.googleusercontent.com/a/AATXAJx1_nHesljBxlEEoYeKfe3ceCXx-W-fFOFC6_Ey=mo,UCSカードの連携をしましたが、クレジットカード用パスワードというのが必要のようでカードからのチャージのログインができません。画面には会員番号は表示されています。 すごくわかりにくい。どうすればいいんだろう。,1,59,1.23.0,2021-11-29 02:03:21,,
gp:AOqpTOF5p9X_Afsxf1Kya6Qb8oORGKkbvZP1QCO3SoIcgKb5-wB7q11eY0Y2NO6faO55FByHphxBhjm3v4e0Ew,植村俊治,https://play-lh.googleusercontent.com/a/AATXAJzBK02B4iJMTpVPZQkCIZw6IFsIdVt1-wFhFAwh=mo,11月28日に使おうと思ってアプリを起動したら、即オチ。レジ前で気がつき慌ててカードを探すハメに。その後、再起動など試しましたがダメでした。早く解消してください。,1,1,1.23.0,2021-11-29 02:00:42,,
gp:AOqpTOGhNkFAh8kh3xfGp-rUGuzeezdPD7v-mDAsK3E6IyKmuFDHZlBUR3CQ_4cZ9G5qep9fpQ7QvJtBjGpddg,ちーにける,https://play-lh.googleusercontent.com/a-/AOh14GgizwgNDbgaCzWHIpM8g_zWN1iIzWUDnCZKYOXx,11/28にお店に行ったらアプリ開けませんでした。レジ前で｢え？マジカのアプリ死んでる｣って声に出して言ってましたけど、店員さん何も教えてくれませんでしたね。諦めてクレカで支払いしましたけど、店員さん知ってましたよね？何か教えてくれればよかったのに…。 ホームページにはアプリの不具合について載ってましたけど、いちいちホームページ見てからお客さんは買い物行きません。 メールでお知らせできたのでは？ チャージ残高あったから行ったのに…。 使えないと分かっていたら行きませんでした。,1,3,1.23.0,2021-11-29 01:50:18,,
gp:AOqpTOGYQmWplY0Rb2bm0p4aYR2hUa9qiSBqLWapDOL9AaEfyFNVnh8RnCG7l5_IRYCV0RVDO3FkkHBzhi-9aA,はむたろ,https://play-lh.googleusercontent.com/a/AATXAJzNxqfOP39NUEMeEMDI8tCDWq07-eBspeUT_yaR=mo,アプリがすぐ落ちて開けない！！,2,1,1.23.0,2021-11-29 01:41:35,,
gp:AOqpTOEWI__aZ25caE7pAAZJpgNm0b1028aVPPMy2ySWxUokEs1OtWoB7mkLj8HbxCgBC_A4pQmyFhqmUVzIag,ケロロ軍曹,https://play-lh.googleusercontent.com/a/AATXAJx6kSUCsrcQcP2G8S75P_Ueqi0Zu1NrIaAj_yYC=mo,「majica」が繰り返し停止してます。の表示が出てアプリが立ち上がらない。このまま立ち上がらかったら入金している金額とポイントが心配です。,1,1,1.23.0,2021-11-29 01:15:55,,
gp:AOqpTOHDHRZAZ24W4bRAMZ_g5bVaIohCyvCjOJ0mLLZzIRF6zr6lsKwOWLOOByQBPSQyh2uQJT6IaMH5AOIj6Q,橋本道一,https://play-lh.googleusercontent.com/a-/AOh14Gh74zyD_7azXJHg1QmJBxta3Kt1eazNSmMMw0BhhA,11/26から起動しません。お金を扱うアプリなのだから、しっかりテストしてから公開して下さい。,1,1,1.23.0,2021-11-29 01:13:47,,
gp:AOqpTOG6t2fLzKBl9NAE-R9HjWesbFNhEiiwX82oiDOxhH6PIfGn11Uk6CRB8zMgj_L_VLlHzRhJCl92nKn4EA,Hiropyon I.,https://play-lh.googleusercontent.com/a-/AOh14GiHDHON5lyWY1_eNbSwcdlgs_CwOAGD15nMS2K2vw,11/26に店舗に行ってアプリを開こうとしても開けず。すぐに閉じてしまう。端末の再起動をしても変わらす。アプリの強制終了などしてもだめ。翌日に試して見てもだめ。空きメモリをみても問題ない。アプリのバージョンアップは何故かできす。アプリが立ち上がらないとできないのかな？最後はアンインストールしようか悩み中。アンインストールするくらいなら、こんな信用できないアプリは捨てようかなとも考え中。アプリにポイントチャージしていなくてよかった。していたら激クレームもの。ただでは済まさないところ。因みに公式サイトに不具合報告があるが、いつ修正版がリリースされるかの情報なし。こんなアプリにチャージなんか怖くてできないね。ひどいアプリだこと。,1,72,1.23.0,2021-11-29 01:06:02,,
gp:AOqpTOG4stUnc0oIhpiZf4eRTg65ym1ffBRUZFR1lUdqlgQEf3MPfQ8hMgdfsRHE6GHKQv2huDi5uCblvQblVQ,はりまるこ,https://play-lh.googleusercontent.com/a-/AOh14GhgIs4UzLgXPnYRWTs1aRdjr08JdKU2qYLUqMx08Q,まる一日アプリが開けません。チャージ残高もあるのにどうなるのか全くわからない。,1,1,1.23.0,2021-11-29 00:59:53,,
gp:AOqpTOFrDfTcdil7j_E2SjRaemRLzCbLY8Q-voXb2cYaDBfck0o1TnozvsDwdQ1s5O0U4RzygTtlfAddCnwdOA,YUKI,https://play-lh.googleusercontent.com/a/AATXAJy5O6oV31iSjvZwEaRGLXzDDXa8B4woEyD7hxnn=mo,昨日28日からアプリが開かない自分だけかと思ったら同様のレビューが…,1,1,,2021-11-29 00:24:33,,
gp:AOqpTOHga0CQxkx5xm60X8XKsoLPDNYYfAto9ErGkVJXsPrbQNgnjTA4BpNP0yoEGHAkKLlhFT01k0RBhIBZfA,takodogg,https://play-lh.googleusercontent.com/a/AATXAJz27QdHeXyFaPC8_0mGbNToriy2iYXlyd-6Oa4e=mo,全く立ち上がらなくなった。 買い物できなくて困る。,1,1,1.23.0,2021-11-28 23:41:22,,
gp:AOqpTOHrZ8m-DyKcp9WvFfNHZ-x5GhPwhAxWHOwHkfGj7mxkxUA0E5sNqoqL-5GDKmXcZIhRVMd1xrKNZikLzg,なる,https://play-lh.googleusercontent.com/a-/AOh14GjdiglR8wZlK6JpToS--O0ZI7RuM2mMzZ42rRA-mA,困ってる方の少しでも参考になれば…。　11/26からログイン出来ませんでした。どなたかが書いていた通り、一度アンインストールして、インストールし直すとログイン出来るようになりました。アンインストールしてもカード番号や登録している電話番号が分かれば、チャージしていた金額もポイントもきちんとそのまま残っていました！便利だと思い結構な額をチャージして使っていましたが、こういうことがあるとチャージしておくのはアプリ怖いなと…。,2,24,1.23.0,2021-11-28 23:35:14,,
gp:AOqpTOFWZZe6r8caBii-bFrPzN6OR0IXYZ5wCDKjpolRhQzrPm4Xu2QqDcXWkUr20JgnaUDY7n-7nCqekXFS4w,小松春香,https://play-lh.googleusercontent.com/a/AATXAJyVYK_4YclrKWXkna80ERTXmEqhmhe1qc5EX6OR=mo,今日、開こうと思ったけど開けなくなってた,2,1,1.23.0,2021-11-28 23:04:34,,
gp:AOqpTOEDGOnlr6KypdeBmi671TW04wezE9uMM7B2vrSLRSOaRwjrwHGDC-_1jNtScuw8CIt1h15UDcpBNLSVjw,小泉拓也,https://play-lh.googleusercontent.com/a/AATXAJx1KbmWbXPkVACsALjsLRC3J9K6Vj5EsATtlccG=mo,前から重くて不便だったが遂に開くことすら出来なくなった。チャージしてる金返せよ,1,2,1.23.0,2021-11-28 22:53:56,,
gp:AOqpTOGqJj_rYS-znCH0yLNMkx3yv7-LfPuhkivc0i52W_NjhvADkC4w6ahv6hutXQZoA5N6IU4oKCQPfPj6Ew,蟹沢智,https://play-lh.googleusercontent.com/a/AATXAJyqcURHRop2gSRTnLCvU7vR6ONlmSbdU96iyETu=mo,繋がらない！役にたたないアプリです,1,1,1.23.0,2021-11-28 22:49:28,,
gp:AOqpTOH2OXl2DNP2TJRavSs5G-D7H0IqLv3yoRzYJpnzK1z-lFqF1Fr9D8bgl6I_GxGlTaVPndrytPQVNt1jRA,M A,https://play-lh.googleusercontent.com/a-/AOh14Gh_7dQMZyqps_xT1PyUvwledqAK88zQ9_9KoIHuYA,ひらけない,1,1,1.23.0,2021-11-28 22:48:46,,
gp:AOqpTOG8cooc8fuJm4ldHpTmzfXzsqt76OGX2LSgNjUxfd1foqGp1eGfxTVwd1YW0itWvjN3ouxXb8h7skBzng,雪だるまさん,https://play-lh.googleusercontent.com/a-/AOh14GjNoeFx7JzJthQ6QwHSQPqZ-niLhqtvfwv4rM7OXA,最悪どうしても立ち上がらないのでアンインストールしてインストールしたがパスワードわからず！リセットもできず。チャージ金返して！,1,1,1.23.0,2021-11-28 22:42:00,,
gp:AOqpTOFj4zqv9cVYXfcuSZeMNjBMLmjWX1TZ-ocvUvqMzAzENT05I4OmgjOsXet_WAH1ugAN9NALgyt45H92fA,頼子冨永,https://play-lh.googleusercontent.com/a/AATXAJwNSMKXq-GkZqveYWp9GplT1XzHKPaRt2-Jn0e4=mo,最寄りのメガドンキホーテがオープンしたのでアプリを開いてみたけど開けない何度やっても開けない　？？？　結局買い物には行かなければならないので買い物はしたけれど　ポイントは付かず　一万円以上買ったのに　不具合の通知もなく無駄に買い物をした気分です。,2,4,1.23.0,2021-11-28 22:35:35,,
gp:AOqpTOGUgjoxJ1IYC3Z3BHJ_GzxqKly0ASc49XVBPTJ0cZOZIxalPxDXREJGNbc6o2Ik9oRlbyUHvdjVm1Pt_A,Googleユーザー,https://play-lh.googleusercontent.com/EGemoI2NTXmTsBVtJqk8jxF9rh8ApRWfsIMQSt2uE4OcpQqbFu7f7NbTK05lx80nuSijCz7sc3a277R67g,2日前からアプリが開かない。同様のコメントが多数書かれているのに、11月28日22:30現在何のアナウンスも無し。,1,6,1.23.0,2021-11-28 22:33:52,,
gp:AOqpTOE4L6zZxsI6wteQwBV5dbcnKgn7QflOYr0SBcrds7n-QAZ8P1Oq0XiGmrDr-x_uwwS8J28YGcI85z8FNA,Ꮶ T,https://play-lh.googleusercontent.com/a/AATXAJyUDwyUaiMAJ7SZbtEWcDeQpR7-hlHBJP6ji4jQ=mo,アンドロイド起動しません。機内モードで開くとバーコードは読み取れるとのことでした。自分からは見れないけど店側からは残高見えてたみたいで現金持ち合わせてなかったけど使えました,2,1,1.23.0,2021-11-28 22:23:21,,
gp:AOqpTOGQCy1STmgPbt9o_UbWxJwnkp_aZB8mszX6hTipoWWFEghhriBWGgB9nOSvSn2OChuoavqKte7Xp0mmRQ,トモヒデシラヤナギ,https://play-lh.googleusercontent.com/a/AATXAJzx2api5IEMA-hVC3I-eKs4KdjfDgq6Yr_qGIF7=mo,チャージしたお金どうするの？ 不具合発生からメールとか公表してないけど？店内と同じでサーバーも立体陳列炎上ですか？大丈夫？ 企業の体質が問われます。,1,1,1.23.0,2021-11-28 22:18:29,,
gp:AOqpTOGvI7v8YAbs91ozuNw_65DN0Ho2k7eAv4-89Ba8obJ4gx2XpSBs_bq1Smvm7-eG8yYbKaD91XufQTfOtw,芝浩二,https://play-lh.googleusercontent.com/a/AATXAJyxCLujKhKv6XXqetihHgILGrO2GSnf3YxFPsj4=mo,アプリが開かない,1,1,1.23.0,2021-11-28 22:15:00,,
gp:AOqpTOH1p6GQzRFhJv76Gw85ZMKNFiDrt9NAHwwlkoMBCUEes2gLiR7FnE9FWQkLPqWS3QlZhbzjDsxQs4FFIw,shiori yamada,https://play-lh.googleusercontent.com/a-/AOh14GiibiJ7TuRLg1u5qaeuRvBzYtinAU855sqlenxcrxc,昨日までアプリを開く事ができていたのに、ドンキ行く前にチラシ見ようかと開いたら、バーコードすら出ない。 店頭で紙クーポンも出せないだろうが！ 下のレビュー見てみたら、12/13にチャージしたら前日に期限切れとかおかしなこと書いてる人がいるけど、関係あるのかな。 残金0とかなってたら許さん！ 以上【2020.12.16のレビュー】 以下【2021.11.28のレビュー】 ここのアプリ担当の人は何回不具合出せば気が済むのか？店頭でカード出さなくてもクレジットカードからチャージが出来て便利ってアプリの筈なのに、アプリが開けないとか意味なし。会員バーコードが開けた所でクレジットチャージが出来ないので結局クレジットカード払いしました。最低でも、店頭の機械でクーポンが出せるQRも表示させるべき。,1,5,1.23.0,2021-11-28 21:49:02,,
gp:AOqpTOFQKlXyDh5W2tU1J1yPzYm6xEj_Ls1vn8EXsv4YXQtzMX8jcGOKdtRV9NTj4cwlYiOE-puPFGZiHiHSEw,ひよりこはる,https://play-lh.googleusercontent.com/a-/AOh14GjL4CwFK-26GQU4KncFT1lgo50_WsbDADWTo_SU0ZA,11月28日21時半現在→一昨日から、アプリが全く開けません。お金を入れているアプリなので、不信感でいっぱいです。買い物に行きましたが使えず、それなのにレジの店員さんからは「マジカはありますか？」と聞かれました。当方の端末が悪いと思い、「開けないんでいいです」と答えてクレジットでの支払いをした後に、レジにシステム障害の事が書かれた紙が貼ってあるのに気付きました。スマホを機内モードにすれば、バーコードのみ出るとのこと。スタッフ全員に、システム障害を周知させる事を怠らないでください。そして、一刻も早く使えるようにしてください。,1,77,1.23.0,2021-11-28 21:47:43,,
gp:AOqpTOG22nmsfdMTgvxbxfsQKjj2lMAmfaM5ro-4cnZtQlKv37cIZ9ecXgVjmbWrTiRcdpsYQKi0OLxiJD9eMg,ゆうもき,https://play-lh.googleusercontent.com/a-/AOh14Gi9ld_zD-Smtf8LnLEu38keOq4lUw9MDUGELD-BxA,アプリが開かなくなった。 残高はどうなるのか。,1,1,1.23.0,2021-11-28 21:44:33,,
gp:AOqpTOGvNQQCuBjrjxYf2_MIVwjcD51GNGUJ_uYCX0TN91DTYZscGq5m81fmLN4HeXd3UdPrpAIKULZ6BHarQA,ふるはたきくこ,https://play-lh.googleusercontent.com/a/AATXAJwRxoThwYDC8edsVJyz0TjdAXiZN_DtdIvNxluq=mo,Androidで使用しています。他の方が書かれている通り、2021/11/28アプリが起動しない不具合が起きましたが、インストールし直したら、起動するようになりました。 再インストール後も残高とポイントは前のままでした。（当然といえば、当然ですが）,3,0,,2021-11-28 21:41:17,,
gp:AOqpTOEx162w4Spp5HDzS-E-uRbfKPU6se6wsKVTOB4rFjP_l59zf3qx7Xk_Hd92AbeCYLGuUXmNd87wJBHCcw,三宅孝子,https://play-lh.googleusercontent.com/a/AATXAJyNH8gpMD3BDoCFTnlBHriTkGqLSTAWWEJtTfY=mo,カードを忘れても携帯さえ持っていれば大丈夫！,5,0,1.23.0,2021-11-28 21:27:10,,
gp:AOqpTOGpRZALK_Yq30EDSf4F0Uhzfo0P46x8S8w_ECiCnmcGkpRLHdyQauM2XAwYmbiIVHtE9p0gSf-jJ-09pA,大和田孝一,https://play-lh.googleusercontent.com/a/AATXAJyQajO6EaqEYbus8ss3-b9kyGYs6LCfyeL3-8vs=mo,今日からアプリ立ち上がらず、レジ前で他の皆さんに迷惑を掛けてしまいました。家に帰ってきてもアプリ起動しません。二日前アップデートが走ったようなので、そのバグですかね。結局カードを、携帯した方が安心ですね。,1,3,1.23.0,2021-11-28 21:15:17,,
gp:AOqpTOFhF-nXW2rboiqOAgDlt02rC2V-GbMfD9sM85NfynmDbCSWP90FC-O5k4hdZDDVHvRt3enJtE9_7TSFAg,R U,https://play-lh.googleusercontent.com/a/AATXAJylj7SthsahAziqVaU6VYrgmvqEOYkV191QGhJl=mo,ここ数日、アプリが立ち上がらず、強制終了する。,1,1,1.23.0,2021-11-28 21:09:49,,
gp:AOqpTOEtGoggCyS0IgAU34EeTa-z7X13-XJ-HBF4fABzh-4HDG0_FiHP9hjEGl58MIKNyid3AYjaf2T6oiaJSw,m k,https://play-lh.googleusercontent.com/a/AATXAJwEXtDAnWswXQFHZq7uIFBOm_x1tU9VEAOEsB9M=mo,majicaのアプリが立ち上がらない！これマジカと思ったら、レビューに他の人もそう書いてある、アナウンスを出さないのはおかしいと思う。,1,2,1.23.0,2021-11-28 21:08:53,,
gp:AOqpTOFcA6ViG9Y215zO424kdSuqmujUdvGQGxjej8gDoxDwBTn3KDKVOu3MVy4GuR_odnlOwm2W_ad5OKmybQ,photo live,https://play-lh.googleusercontent.com/a-/AOh14GgZ8t10gh0zy8M82VFg27mqC2Skwldsko9M2PfG8w,Androidで使用不可w 残金返して！ カードは実家にあるから 手元にない ざけんな,1,1,1.23.0,2021-11-28 20:36:51,,
