2023-11-22 20:34:31+00:00,1727425348936335623,"@cookaikorekuuka ですよね(*´艸`)❤
社長も楽しくお仕事したい派なので、毎日推し活(モフにゃん)トークしてます(​ *´꒳`*​)"
2023-11-22 09:25:29+00:00,1727256978723135914,@MikiKMYD (=^っ🐱🎤๑❛ ᴗ❛๑c^=)💛🌠✨ﾐｰﾆｬ~ﾝ みーにゃん！トークショーたのしみーにゃんですね~！がんばってね~！ﾗｲﾌﾞもﾒﾁｬﾒﾁｬたのしみーにゃん！！ｲｴ~ｲ!!ﾐｰﾆｬﾝﾐｰﾆｬ~ﾝ!!♪♪🎶🎀🍿🍭🍦🐈🐾🌠✨
2023-11-20 18:16:41+00:00,1726665884352340244,"RT @murabito3d: にゃんトークによって大好きな
咲夜ちゃんへのツンデレっぷりを
看破されるミケちゃん( ꈍᴗꈍ) https://t.co/XcmA9ouZX1"
2023-11-19 16:12:00+00:00,1726272118789480921,@mia_risodq10 にゃんトークだおー！
2023-11-19 14:59:20+00:00,1726253830244077644,"にゃんトーク見ると
昨日からご機嫌斜めなはちまる🐈‍⬛ https://t.co/WfJzAR340q"
2023-11-19 13:14:05+00:00,1726227346901123352,"RT @hinatazaka_46hi: あと！たまにゃんトークは、
たまにゃんだけじゃなくて、
四期も多々出てくる
(トーク内容、写真など)ので
最初は推しメンが出てくるならな～程度の
気持ちでも購読することをオススメします！
損はさせません。(←誰)"
2023-11-19 13:13:36+00:00,1726227222707740866,"あと！たまにゃんトークは、
たまにゃんだけじゃなくて、
四期も多々出てくる
(トーク内容、写真など)ので
最初は推しメンが出てくるならな～程度の
気持ちでも購読することをオススメします！
損はさせません。(←誰) https://t.co/0Dlb29Cx47"
2023-11-19 08:02:41+00:00,1726148976720880118,にゃんトーク入れて良かった···( ˇωˇ ) https://t.co/xjcaTs8DPM
2023-11-18 04:39:04+00:00,1725735350663057557,"かおりんふーにゃんトークショー楽しかった！！
ふーにゃんのお母さんが声優だったのは知らなくて驚いた...
たこチュクミは当てるの難しすぎる🐙😂
司会の方まで呼ばれててすごく楽しめました！
米粉クレープも頂きました😋
#千葉経済大学大学祭 https://t.co/EzmOm8QlL5"
